Date&Time,Tweet,Tweet_ID,ReTweet_Count,Favorite_Count,Tweet_Source
2021-11-04 23:04:41+00:00,"I’m grateful for the leadership of our @Breakthrough Energy Catalyst public and private sector partners. By taking coordinated, courageous climate action, we can lower Green Premiums and deploy the clean technologies that will help us reach net zero. https://t.co/WIiWOwwBZK",1456397015743492106,154,1418,Twitter Web App
2021-11-04 18:00:41+00:00,Getting to zero emissions will be the hardest thing people have ever done. This was a great conversation about the power of innovation and what the world can accomplish if we work together. https://t.co/aF1dHBlclm,1456320508882915334,202,1730,Twitter Web App
2021-11-04 16:05:03+00:00,I was truly inspired to hear @Vinisha27738476 speak at #COP26 this week. Her optimism and passion for innovation makes me hopeful that we can avoid a climate disaster. https://t.co/AFPskeuyne,1456291410718511112,338,2503,Twitter Web App
2021-11-03 23:11:35+00:00,"Thank you, @SecGranholm for your leadership. The commitment of @ENERGY and the innovate spirit of our National Labs will drive the breakthroughs we need to help the whole world get to #NetZero. https://t.co/RutwW0EFoH",1456036362948202498,140,1302,Twitter Web App
2021-11-03 21:47:12+00:00,Public-private collaborations will be critical to reducing emissions and achieving our 2050 climate goals. Our work with @MICleanEnergyRD will help us do just that. https://t.co/RH5nPZhKrd,1456015126935474176,118,1127,Twitter Web App
2021-11-03 21:42:20+00:00,"I’m excited about @Breakthrough Energy’s expanded work with @MICleanEnergyRD. Thank you, @JonathanWNV for your partnership. https://t.co/p04UE7gyjv",1456013903599603714,99,1127,Twitter Web App
2021-11-03 19:48:41+00:00,RT @rodger_voorhies: Smallholder agriculture is a pathway out of poverty for so many. Bold action at #COP26 and increased funding for @CGIA…,1455985302930001921,57,0,Twitter Web App
2021-11-03 16:41:51+00:00,"RT @MICleanEnergyRD: Today, @Breakthrough Energy and #MissionInnovation announced plans to expand our impact together. 👏 Public and private…",1455938285604270082,104,0,Twitter Web App
2021-11-02 23:43:03+00:00,"Thank you, @KensingtonRoyal for your commitment to repairing our planet. It was inspiring to see the ingenuity and innovation of the @EarthshotPrize finalists. https://t.co/9pevxeVOb3",1455681893328850950,327,2957,Twitter Web App
2021-11-02 22:17:17+00:00,Great to see @naftalibennett’s commitment alongside global leaders present @COP26 today. The world needs bold action to support the development of new technology to slow emissions and help the world adapt to the changing climate. https://t.co/h14dzmE0M3,1455660312145715200,283,2816,Twitter Web App
2021-11-02 20:24:54+00:00,".@Breakthrough Energy Catalyst is bringing together private and public sector leaders to invest in innovation and accelerate clean technologies. @Citi, @IKEAFoundation, and @StateFarm are joining our efforts to help fund solutions that will ignite a green industrial revolution. https://t.co/nA0STTqaI1",1455632027596644354,124,989,Twitter Web App
2021-11-02 18:42:29+00:00,"Unless smallholder farmers can adapt to climate change, we will lose the global battle against hunger and poverty. @AIMforClimate is rising to the challenge and supporting major investments in @CGIAR to power agricultural innovation. https://t.co/ujvrDLo9EW",1455606254131314688,186,1374,Twitter Web App
2021-11-02 17:31:12+00:00,"Thank you, @vonderleyen. This $1B partnership between @Breakthrough Energy Catalyst, @EU_Commission, and @EIB will help accelerate the deployment of critical climate technologies. I’m grateful for our continued collaboration. https://t.co/bUM8zW3cuk",1455588313235030018,156,1219,Twitter Web App
2021-11-02 17:01:53+00:00,RT @narendramodi: Had an excellent meeting with @BillGates at the @COP26 Summit. We discussed a wide range of subjects including ways to st…,1455580938369261572,4037,0,Twitter Web App
2021-11-02 16:46:29+00:00,"Encouraged to discuss with PM @narendramodi on the sidelines of #COP26 the potential of further investments in science, innovation and transformative agriculture R&amp;D as an important foundation for mitigating impact of climate change on small landowning farmers @PMOIndia @nstomar. https://t.co/Le74Vr3PzO",1455577063822282758,317,2946,Twitter Web App
2021-11-02 16:19:34+00:00,One of my top priorities here at #COP26 is making sure that the world prioritizes scaling clean technology innovation. Here is the message I delivered to world leaders earlier today: https://t.co/m4mEpj5wIb,1455570288792326153,250,2166,Twitter Web App
2021-11-01 21:06:33+00:00,"RT @Breakthrough: This week, public- and private-sector leaders from around the world are convening for @COP26. Joining them will be BE’s f…",1455280122768998401,85,0,Twitter Web App
2021-11-01 18:28:02+00:00,"In addition to investments in reducing emissions to slow climate change, we need to help those already impacted by climate change adapt. https://t.co/4cPN4vxZei",1455240228445196291,208,1772,Twitter Web App
2021-10-31 20:06:52+00:00,"By bringing the world together at #COP26, we can find more ways to accelerate the development and adoption of the clean technologies we need to reach net-zero emissions. https://t.co/kIJqTVaOCJ",1454902715155316742,140,1446,Twitter Web App
2021-10-31 20:06:52+00:00,"At this year’s UN Climate Conference, innovation will take center stage and I’m optimistic about the road ahead. https://t.co/5kFMgeoo4r",1454902714014453765,244,2496,Twitter Web App
2021-10-31 14:51:14+00:00,I hope Congress passes the Build Back Better Act and the Infrastructure Investment and Jobs Act fast. We can’t wait another moment. https://t.co/bz1XRoQGnh,1454823281870004250,225,2204,Twitter Web App
2021-10-27 19:51:56+00:00,"Good to see this commitment by @Merck to help ensure from the outset that molnupiravir, a potential treatment for COVID-19, will be available to many more nations. https://t.co/5gYFcYtj8a",1453449405890060289,254,2442,Twitter Web App
2021-10-27 14:27:58+00:00,"To avoid a climate disaster, we need young people’s ideas and energy. College and university students anywhere in the world can download my book for free: https://t.co/W6cfL580oD https://t.co/pbKNEwV9WZ",1453367874848837638,649,3429,Twitter Web App
2021-10-26 14:20:11+00:00,It’s great to see the strong commitment of partners like @MohamedBinZayed and the dedication on the front line to eradicate polio. On #WorldPolioDay we recognize progress and acknowledge that the fight continues. https://t.co/Ue9gLlN7VN,1453003527803052040,271,3288,Twitter Web App
2021-10-25 13:44:38+00:00,"This week, any college or university student anywhere in the world can download my book How to Avoid a Climate Disaster for free. https://t.co/QvuHREOlx5",1452632195621818373,1601,7198,Twitter Web App
2021-10-24 21:54:23+00:00,"RT @gatesfoundation: A polio-free world is possible, but only if everyone works together. This #WorldPolioDay, we’re proud to continue work…",1452393058486521856,122,0,Twitter Web App
2021-10-24 15:16:42+00:00,This #WorldPolioDay you can support Shumaila and other polio workers by donating to @Rotary’s fight against polio. Our foundation is giving a 2-to-1 match to every donation. Learn more: https://t.co/CBDqWHicUa,1452292976114290705,265,2401,Twitter Web App
2021-10-23 19:57:08+00:00,The world needs heroes like Shumaila Rehmani. I’m inspired by the impact she’s making in her community to save lives and help #EndPolio. https://t.co/l1S88506Cm,1452001161603547139,342,3276,Twitter Web App
2021-10-22 22:50:47+00:00,I’ve been binging geography videos lately. I liked this one where Geography King explains several really fascinating quirks of US geography (including why it doesn’t actually rain as much as people think in my hometown). https://t.co/XEoErF60UL,1451682475676102660,185,2183,Twitter Web App
2021-10-22 05:19:24+00:00,"India has administered 1 billion vaccine doses, a testament to India’s innovation, ability to manufacture at scale, and the efforts of millions of health workers backed by CoWIN. Congratulations @narendramodi @mansukhmandviya @PMOIndia @MoHFW_India https://t.co/vygRkSkPRm",1451417887151779842,5017,28362,Twitter Web App
2021-10-21 19:28:27+00:00,The world is so close to ending polio thanks to heroes like Shumaila Rehmani: https://t.co/PubfuEMuIv #WorldPolioDay https://t.co/R6bFsfgUHr,1451269167231897600,301,2446,Twitter Web App
2021-10-20 04:05:14+00:00,Our funding is only part of the solution. More donors will need to step up to make sure molnupiravir is available to all as quickly as possible.,1450674444993585165,79,1196,Twitter Web App
2021-10-20 04:05:14+00:00,"Everyone deserves equitable access to healthcare. That’s why we engaged partners like @MedsForAll and @OfficialUoM to find more affordable, safe materials that generic manufacturers can use to produce medicines at a lower cost.",1450674443840151556,93,1275,Twitter Web App
2021-10-20 04:05:14+00:00,"We’ve done this before. In 2017, the @gatesfoundation worked with partners and generic suppliers to bring improved HIV therapies to more than 18 million people in lower-income countries.",1450674442682523655,21,239,Twitter Web App
2021-10-20 04:05:13+00:00,"If we’re going to end the acute phase of the pandemic, life-saving drugs like molnupiravir must be available to everyone who needs them. https://t.co/G6kxmIySGr",1450674441155846149,301,2885,Twitter Web App
2021-10-19 20:00:32+00:00,"By investing in direct air capture, clean hydrogen, long-duration energy storage, and sustainable aviation fuel, we’ll create a new industrial revolution that will power the global clean energy economy: https://t.co/NwZZakjhN8",1450552465267441667,152,1580,Twitter Web App
2021-10-19 20:00:32+00:00,Earlier today I attended the #GlobalInvestmentSummit where we announced @Breakthrough Energy Catalyst’s latest partnership to accelerate climate technologies. Thanks to the UK government &amp; @10DowningStreet for taking bold action. https://t.co/ex5nuvrjiF,1450552463942062080,221,2139,Twitter Web App
2021-10-19 17:50:18+00:00,"RT @Breakthrough: Today, we’re excited to announce a new partnership between the UK Government and BE Catalyst. Our collaboration with @UKi…",1450519692058062854,67,0,Twitter Web App
2021-10-19 14:30:09+00:00,I’m grateful to have joined @BorisJohnson today to highlight the important work that @Breakthrough Energy Catalyst is doing to accelerate clean technologies. Our partnership with the UK will be critical to building the net-zero economy. https://t.co/NRnBOleUoL,1450469322883805258,282,2796,Twitter Web App
2021-10-18 17:07:30+00:00,"Jenn and Nayel, it’s impossible to put into words how happy it makes me to see you filled with joy on your wedding day. I’m so proud of you both for everything you’ve accomplished in your lives so far and everything you will do with your future together. https://t.co/zXRCKxKSle",1450146533073059845,313,5778,Twitter Web App
2021-10-15 17:56:47+00:00,"Reaching net zero will take bold action and creativity, and the first cohort of @Breakthrough Energy Fellows makes me optimistic that we can propel a new industrial revolution. https://t.co/lTI121sg4Y",1449071773274624004,214,1498,Twitter Web App
2021-10-13 17:07:19+00:00,"I wrote about two ways to achieve vaccine equity in the future. If the world makes the right investments and decisions now, we can make things better next time. And maybe even make sure there is no next time at all. https://t.co/ZdYHMQt7qP",1448334548152897536,188,1410,Twitter Web App
2021-10-13 17:07:19+00:00,"Still, the disparities in access to the COVID-19 vaccine are shocking and unjust. Only 2 percent of people in low-income countries have received any COVID-19 vaccines. And the gap may be getting even larger as rich-world governments buy up extra doses to serve as booster shots.",1448334546445869058,142,1365,Twitter Web App
2021-10-13 17:07:18+00:00,"Inequity in health is not new. Each year, more than 5 million children—almost entirely in low- and middle-income countries—die before their fifth birthday from mostly preventable diseases. Reducing this gap has been the Gates Foundation’s top priority for more than 20 years.",1448334544721960960,290,2706,Twitter Web App
2021-10-12 16:58:40+00:00,The pandemic has worsened inequities. But it's also shown the world what's possible when we come together. Read why there's reason to be optimistic in our 2021 Goalkeepers Report. https://t.co/2XUNjdwCyf,1447969981967204353,171,1566,Twitter Web App
2021-10-08 19:17:18+00:00,"RT @rajpanjabi: If COVID-19 reminds us we live in an age of pandemics, then heeding the lessons from fighting malaria, a pandemic of the ag…",1446555319769780225,217,0,Twitter Web App
2021-10-07 14:13:53+00:00,This work has been critical to our understanding of the causes and impacts of climate change. Congratulations on this well-deserved recognition. https://t.co/laBJxn25kr,1446116573823967245,301,2888,Twitter Web App
2021-10-07 00:03:58+00:00,What a fantastic leader Dr. Collins has been. The U.S. is lucky to have amazing scientists and public health professionals like him. He leaves an incredible legacy. https://t.co/knShQdEDoe,1445902684440068097,137,1755,Twitter Web App
2021-10-05 19:05:36+00:00,"Thanks, as always, @zannymb for the thoughtful conversation. I look forward to continuing to talk with business leaders, governments, and activists at #COP26 about how we can work together to avoid a climate disaster. https://t.co/EbpAfPoXBq",1445465212774064135,194,1376,Twitter Web App
2021-10-05 14:16:56+00:00,Stephanie and Victoria had no plans to go to college until they met Valerie from @AdvisingCorps. This organization helped them realize their dreams: https://t.co/T1nbp6hZUk https://t.co/RPXSsGykg9,1445392566363566090,211,2175,Twitter Web App
2021-10-02 18:03:07+00:00,"No one person can solve climate change on their own. However, if we make breakthroughs in zero-carbon innovations, we can avoid a climate disaster together. Thanks to @Kurz_Gesagt for creating this informative video. https://t.co/aUdXfnpmnL",1444362321309024256,464,3710,Twitter Web App
2021-10-01 17:33:41+00:00,"Happy Birthday, President Carter. You set a great example for all of us, and I am always inspired by your amazing work. https://t.co/fOQjA5Of0R",1443992530324844545,295,4106,Twitter Web App
2021-09-30 16:46:28+00:00,The College @AdvisingCorps is helping students navigate the challenges of continuing their education after high school. https://t.co/JoWpuUCUwe,1443618257395589146,159,1625,Twitter Web App
2021-09-29 22:18:24+00:00,Girin Beeharry was an extraordinary leader and good friend. I’m saddened by his death and inspired by his work to improve lives in India and around the world. https://t.co/8qCmPFtO8G,1443339404022468611,152,1597,Twitter Web App
2021-09-29 16:38:18+00:00,I’m excited about the launch of @CipherClimate by Breakthrough Energy. The first issue includes an important discussion with U.S. Energy Secretary @SecGranholm and new data showing record amounts of cleantech investment. https://t.co/70lVFUWEQ2,1443253813071077376,152,1362,Twitter Web App
2021-09-28 23:57:27+00:00,"Congratulations @trvrb on this well-deserved recognition. Like you, I’m optimistic that we will be able to bring this pandemic to an end. Your work with the @seattleflustudy and many others will also help us to better prepare for future pandemics. https://t.co/nd76gU0fGn",1443001944658755597,148,1449,Twitter Web App
2021-09-28 22:02:35+00:00,"Congratulations @narendramodi on the national launch of Ayushman Bharat Digital Mission. This digital health infrastructure will help ensure equitable, accessible healthcare delivery and accelerate progress on India’s health goals. @PMOIndia @MoHFW_INDIA https://t.co/FbfKyNSfXI",1442973036081139714,6149,31590,Twitter Web App
2021-09-27 15:52:45+00:00,What if your smart phone could detect Alzheimer’s? @TheADDF's Diagnostics Accelerator is working to make this a reality: https://t.co/57PSnmrTVR,1442517577394098177,310,2322,Twitter Web App
2021-09-24 21:42:33+00:00,India is a great example of a country that has invested in its capacity. Today 2/3rds of all the world's children receive a vaccine that was made in India: https://t.co/0Ra2PlIQLd,1441518443895820293,320,2042,Twitter Web App
2021-09-24 21:42:32+00:00,"Expanding the geography of vaccine manufacturing to better meet vaccine needs, both for pandemics and routine immunization, is a critical task. https://t.co/64gBEEWZLg",1441518440305487878,337,2656,Twitter Web App
2021-09-24 00:04:06+00:00,"Thanks for having me on the show, @JKCorden! And thanks to the all of the late night hosts for focusing on this critical challenge. I’m optimistic that we can come together to avoid a climate disaster. https://t.co/D8bDBA2NOQ",1441191677465481222,224,1992,Twitter Web App
2021-09-23 23:14:59+00:00,"In our recent Goalkeepers report, we share some of the lessons that we’ve learned from the world’s response to the COVID-19 pandemic: https://t.co/9Ta5hIGRPf",1441179318374191106,66,732,Twitter Web App
2021-09-23 23:02:36+00:00,Thanks for the conversation and for your leadership in helping to end this pandemic and prevent the next one. https://t.co/eVypFhDTE5,1441176198139170827,143,1281,Twitter Web App
2021-09-23 17:07:44+00:00,More than 80% of COVID-19 vaccines have been administered in high- and upper-middle-income countries while less than 1% have been administered in low-income countries. This is both profoundly unfair and hinders progress towards ending the pandemic: https://t.co/VXVBKkv7hL https://t.co/ULaqGJR7Mf,1441086893806944270,398,2044,Twitter Web App
2021-09-23 03:05:12+00:00,"A global response will help the world end the COVID crisis. I'm glad to see so many leaders coming together at this U.S.-led virtual Global COVID-19 summit, and look forward to their continued efforts to help the world move out of the acute phase of this pandemic. https://t.co/6iilrL2AyG",1440874865095942152,232,1740,Twitter Web App
2021-09-22 16:58:35+00:00,"Earlier I shared three actions that leaders could take to help the world out of the pandemic. For those who want to go deeper, the @gatesfoundation shares more detail on what’s needed to end this crisis: https://t.co/1Ftke22T0k",1440722206351233024,115,1129,Twitter Web App
2021-09-22 02:49:49+00:00,"If we want to stop Alzheimer’s disease, one of the biggest things we need to develop is a reliable, affordable, and accessible diagnostic. Breakthroughs in testing may someday soon let us substantially alter the course of the disease: https://t.co/l2rq17EsGZ #WorldAlzheimersDay https://t.co/RLJJQsvDXm",1440508603849273353,311,2198,Twitter Web App
2021-09-21 22:19:36+00:00,There are three things that can be done in the coming months to bring an end to the acute phase of the pandemic and set the world on a different timeline in preparation for the next. https://t.co/41ImCLHpgt,1440440604744249348,314,2363,Twitter Web App
2021-09-20 23:25:36+00:00,#WorldAlzheimersDay is an inspiring reminder that hope is on the horizon. Brilliant scientists all over the world are working hard to stop Alzheimer’s disease—and they’re making terrific progress. https://t.co/BJKp8mJRRt,1440094823856291845,468,2583,Twitter Web App
2021-09-20 15:01:40+00:00,Avoiding a climate disaster will require a new industrial revolution. I'm excited to see @Breakthrough Energy Catalyst announce the first private sector anchor partners who will work together to build the clean industries of the future. https://t.co/93OV0MLUW3,1439968005467742210,195,1688,Twitter Web App
2021-09-20 02:08:13+00:00,"As we’ve seen this past year, new variants of a disease can emerge over time. In order to develop new tools to fight the disease, we need to identify those variants quickly. Dr. Senjuti Saha is one expert working to sequence SARS-CoV-2: https://t.co/XxexUmVwHo https://t.co/cEbA3TuEos",1439773362364944392,443,3042,Twitter Web App
2021-09-17 17:17:35+00:00,"But the fact that we can point to positive signs amid a once-in-a-generation global pandemic is extraordinary. With one hand tied behind their backs, countless individuals, organizations, and countries went above and beyond. https://t.co/InzRGXGtyc",1438915048571686914,81,783,Twitter Web App
2021-09-17 17:17:35+00:00,"Of course, the full extent of the pandemic’s impact on the SDGs will take years to fully understand, as more and better data becomes available. And this data doesn’t diminish the very real suffering the pandemic has caused for people everywhere—far from it.",1438915046613012485,65,761,Twitter Web App
2021-09-17 17:17:35+00:00,Initial projections about the pandemic’s impact on the fight against malaria were dire. But that projection spurred many countries to action to ensure that bed nets were distributed and that testing and antimalarial drugs remained available.,1438915045203726336,23,234,Twitter Web App
2021-09-17 17:17:34+00:00,"When the pandemic hit, many feared the worst when it came to maintaining progress on fighting other diseases. But all over the world people stepped up to avert the worst-case scenarios. One example is malaria: https://t.co/InzRGXGtyc https://t.co/aM5mszTtWR",1438915041277857793,215,1787,Twitter Web App
2021-09-15 19:02:48+00:00,"Where you live shouldn’t determine whether or not you have access to a Covid-19 vaccine, health supplies, or a diagnostic test: https://t.co/DbwClIBRox https://t.co/eeH7Ezn0Fb",1438216750697365506,334,2538,Twitter Web App
2021-09-14 16:36:47+00:00,"Even amid the devastation of the COVID-19 pandemic, we’ve seen that progress can continue thanks to work started years earlier. In this year’s #Goalkeepers2030 report, we share some of the lessons that have inspired all of us at the @gatesfoundation. https://t.co/pTc6N1cg4J",1437817616530227202,171,1406,Twitter Web App
2021-09-13 14:45:18+00:00,This news is not surprising to many of us who work in global health. But there are things the world can do to help get management of these diseases back on track. I’m eager to share more in the annual Goalkeepers report tomorrow. https://t.co/3Q6QE1prmG #Goalkeepers2030,1437427173174898691,182,1787,Twitter Web App
2021-09-11 16:42:18+00:00,I’m thinking today about the frontline heroes who risked their lives for us on September 11th and those who continue to serve our country every day.,1436731841893920776,423,6910,Twitter Web App
2021-09-10 18:02:52+00:00,"RT @gatesfoundation: The 2021 Goalkeepers Report is out next week!

In 2015, 193 world leaders agreed to 17 Global Goals to end poverty, fi…",1436389727536562183,171,0,Twitter Web App
2021-09-09 16:37:54+00:00,"“How do we use technology and innovation to solve today’s problems?” That’s the question David Sengeh, Sierra Leone’s chief innovation officer and education minister, is looking to answer with the country’s National Innovation and Digital Strategy: https://t.co/btg2gPFI4Q https://t.co/EV9zh7Lq0x",1436005956907720704,217,1685,Twitter Web App
2021-09-08 17:06:36+00:00,The world needs many breakthroughs to get from 51 billion tons of greenhouse gases to zero in order to avoid a climate disaster. It’s encouraging to see this kind of collaboration. https://t.co/wW6ftAL5id,1435650793080717315,330,2627,Twitter Web App
2021-09-07 21:33:44+00:00,I found the book to be valuable on a number of levels and will have more to say about it soon! https://t.co/Ur2aE81FyV,1435355631767080961,185,2452,Twitter Web App
2021-09-07 17:23:39+00:00,"The first time I met David Sengeh, I was blown away by his intellect, his ambition, and his sense of humor. He has been a remarkable advocate for Sierra Leone, and I’m confident that we’ll be hearing about @dsengeh’s amazing work for decades to come. https://t.co/js7uakLj4m",1435292695652536324,282,1970,Twitter Web App
2021-09-03 20:55:48+00:00,"Africa's success against wild polio last year is one of the most inspiring stories in global health. I’m optimistic that, with the commitment and collaboration that achieved that goal, countries in the region can beat all forms of the virus and #EndPolio https://t.co/lpJsrhAQcf",1433896533758410752,293,2855,Twitter Web App
2021-09-01 17:01:58+00:00,None of us would be where we are today without the incredible teachers who helped shape our perspectives. Brooke Brown is an extraordinary teacher who has helped her students adapt to extraordinary times. https://t.co/btiQikTyVX,1433112909911969793,225,2479,Twitter Web App
2021-08-31 20:57:07+00:00,".@GAP_Foundation’s Bio-Hermes Study is the first to compare results of blood and digital biomarker tests with imaging and traditional cognitive tests. This could help identify Alzheimer’s earlier and detect progression of the disease, to help us get closer to a cure. https://t.co/9xUQ0ZldSI",1432809700618211329,163,1253,Twitter Web App
2021-08-31 16:45:34+00:00,"I recently sat down with the extraordinary Brooke Brown, Washington State’s 2021 Teacher of the Year. It was a pleasure to meet with her and take part in one of her favorite lessons: https://t.co/TAwysEihyQ https://t.co/rlB1iJjogC",1432746395669200896,211,1997,Twitter Web App
2021-08-30 15:32:12+00:00,"Happy Birthday, Warren! You’ve been a true friend and an invaluable source of advice over the years, and I’m so lucky to know you. It’s an honor to work at the foundation doing my best to turn your generosity into lives saved and improved. Here’s to many more birthdays! https://t.co/ZaCGW5KCWm",1432365544074723329,693,8128,Twitter Web App
