Date&Time,Tweet,Tweet_ID,ReTweet_Count,Favorite_Count,Tweet_Source
2019-12-16 17:44:33+00:00,December is a great time to take stock of everything you’ve done over the last twelve months—including all of the books you’ve read. I found these books to be really clever and engaging. I hope you them find as intriguing as I did: https://t.co/xKdpvoXbvR https://t.co/XZguGFYssO,1206631210530656256,1358,7441,Twitter Media Studio
2019-12-16 01:27:00+00:00,"Back in my early Microsoft days, I routinely pulled all-nighters when we had to deliver a piece of software. I even stayed up two nights in a row on occasion–I don’t recommend that. This book taught me a lot about the importance of a better night's sleep. https://t.co/xUthhTyRb6",1206385201594671105,2757,17209,Sprinklr
2019-12-15 16:03:00+00:00,This new treatment is a gamechanger for millions of people living with HIV in South Africa. I’m optimistic that it could help #EndAIDS around the world. https://t.co/vrvqM9DA3w,1206243266276077568,706,4411,Sprinklr
2019-12-13 19:30:00+00:00,I was deeply moved by Tayari Jones’s story of a married couple whose lives get torn apart by an incident of injustice. The book is so well-written that you’ll find yourself sucked into it despite the heavy subject matter. https://t.co/JAhJOFwdOm,1205570585373401090,445,3921,Sprinklr
2019-12-12 16:52:28+00:00,Here are two amazing statistics: primary health care interventions could save 60 million lives in low-and middle-income countries and increase average life expectancy by 3.7 years by 2030: https://t.co/VfDzACwTNu #HealthForAll https://t.co/tQTEyIaQj3,1205168553583923201,532,2958,Sprinklr
2019-12-11 18:30:00+00:00,"Diane Tavenner had a simple but very ambitious goal: “We wanted to teach kids not just what they needed to get into college, but what they needed to live a good life.” You can read an excerpt from her wonderful new book on my blog. https://t.co/hYwdeNFTPM",1204830710911184896,449,2898,Sprinklr
2019-12-10 19:21:11+00:00,I’ve read a lot of great books this year. Here are some I think you’ll enjoy reading over the holidays. https://t.co/YOpc07Qv3T,1204481201156894720,1817,11007,Sprinklr
2019-12-09 04:00:45+00:00,I'm a big fan of @SiliconHBO and was excited when they asked me to appear in the series finale tonight. #AlwaysBlue https://t.co/kDnM81w8IF,1203887178192785411,2218,19784,Twitter Web App
2019-12-05 18:43:49+00:00,"Thank you, Sue, for your extraordinary leadership. Melinda and I are grateful for the opportunity we’ve had to learn with and from you over the past five-and-a-half years, and we wish you and your family the best. https://t.co/VsVPTo731p",1202659858538872832,374,4619,Twitter Web App
2019-12-04 17:47:01+00:00,"I really enjoyed sitting down with @reidhoffman to talk about the role great cofounders and partners have played in my career, like Paul Allen at Microsoft and @melindagates at the Gates Foundation. You can listen to our conversation here: https://t.co/GlFWwylYcI https://t.co/JQjdxFGxle",1202283177211047940,367,4049,Sprinklr
2019-12-03 14:52:46+00:00,Technology has made it faster and easier than ever before for people everywhere to give. I’m inspired by how many people from all over the world participate in #GivingTuesday. https://t.co/CkwcQb5roI https://t.co/VjIycC6Kig,1201876939427987459,560,4040,Sprinklr
2019-12-02 19:58:52+00:00,I was impressed to see the tremendous impact @Gestamp’s apprenticeship program is having on students and their community: https://t.co/VFuOrRM9ms https://t.co/2GkWeB6Ojj,1201591581385486336,483,3665,Twitter Media Studio
2019-12-01 12:47:00+00:00,"This #WorldAIDSDay, I’m excited about breakthroughs in treating and preventing HIV thanks to organizations like the @GlobalFund. https://t.co/Sm5dUhTR2A",1201120511671111680,821,6327,Sprinklr
2019-12-01 02:34:24+00:00,"The world has made incredible strides toward ending the AIDS epidemic over the last twenty years, and I’m optimistic that more progress is on the way. Explore the data: https://t.co/uQ05HXrrPL #WorldAIDSDay",1200966347259297792,599,4421,Sprinklr
2019-11-27 00:07:55+00:00,"At @Gestamp, an auto parts maker in Chattanooga, Tennessee, I saw how the factory is putting high school students on a path to opportunity: https://t.co/EAB1Enj48G https://t.co/3rhl9PSfQt",1199479929768947712,508,5743,Sprinklr
2019-11-25 22:06:20+00:00,Dr. LeAndrea Ware is one of the most energetic school leaders I’ve ever met. Her positivity is infectious. It’s no wonder she was recently named the Tennessee principal of the year: https://t.co/wGwZju8qS7 https://t.co/SmZDJNXzvL,1199086944220676097,517,4142,Twitter Media Studio
2019-11-25 02:50:28+00:00,We’re getting closer to having a blood test for Alzheimer’s – which could help doctors detect and diagnose the disease earlier: https://t.co/L6m5WYhova https://t.co/AyR2EqyEHO,1198796062993125376,2859,19039,Sprinklr
2019-11-22 15:23:32+00:00,"US education may be the hardest issue our foundation works on. A recent visit to The Howard School in Chattanooga, Tennessee reminded me why it’s also one of the most inspiring. https://t.co/927CwK2imF",1197898412261281792,496,4649,Sprinklr
2019-11-20 21:47:20+00:00,"You could find wild poliovirus in 125 countries in 1988. Today, it exists in just two. And more than 18 million people are walking today who would otherwise have been paralyzed by polio. Here’s why we aren’t done yet: https://t.co/uXZoglQS7Z https://t.co/rY2eMaDReI",1197270223700791303,1004,6240,Sprinklr
2019-11-20 17:24:40+00:00,"The incredible, diverse global partnership that halted wild polio’s spread in Nigeria 3 years ago makes me optimistic we’ll #EndPolio worldwide. https://t.co/Kr3ibLXdmd",1197204122933563394,368,2720,Sprinklr
2019-11-20 04:43:01+00:00,"Some of our most vital partners in the fight to #EndPolio are philanthropies like @alwaleed_philan, @bloombergdotorg, Tahir Foundation, Dalio Philanthropies &amp; Ningxia Yanbao Charity Foundation. Their support has helped deliver vaccines and protect millions from polio paralysis. https://t.co/w6yUlN1CwX",1197012446092894209,470,4092,Sprinklr
2019-11-20 01:25:00+00:00,"Even a single child paralyzed by polio is one too many, but I’m optimistic that we will eradicate the disease thanks to the GPEI’s persistence and creativity. https://t.co/olGWetQPSN",1196962613709684737,580,5184,Sprinklr
2019-11-19 22:51:08+00:00,"In Abu Dhabi this week, the world committed $2.6B to #EndPolio. Thank you @MohamedBinZayed for your leadership in helping push this terrible disease to the brink of eradication. https://t.co/7tr4wNQjRK",1196923893065359365,1129,7024,Sprinklr
2019-11-18 18:18:44+00:00,"@narendramodi .@narendramodi's leadership has been a catalyst to India's progress on improving health, nutrition and ensuring safe sanitation practices for many. @PMOIndia",1196492955210506241,1476,9310,Twitter Web App
2019-11-10 17:24:06+00:00,"The more I’ve learned about Alzheimer’s disease, the more I’ve come to admire the volunteers who participate in clinical trials, and their caregivers too. Here’s a way you can help fight Alzheimer’s: https://t.co/isfZoyZFPU https://t.co/rS27wglMOJ",1193580102237319168,1073,7549,Twitter Media Studio
2019-11-10 00:27:26+00:00,Better tools for collecting and sharing data will help community health workers protect families in the poorest parts of the world.  https://t.co/dVONnMcY4c,1193324249852846080,1175,8554,Sprinklr
2019-11-08 18:28:56+00:00,Expanding the diversity of therapies in the pipeline and more efficiently recruiting patients for clinical trials will increase our odds of discovering a breakthrough. I’m hopeful it will lead to an intervention that reduces the impact of Alzheimer’s. https://t.co/j8DZbeUp8F,1192871641044226050,873,6040,Twitter Web App
2019-11-07 15:23:06+00:00,@ewarren I’m always willing to talk about creative solutions to these problems.,1192462488895275010,104,1781,Twitter Web App
2019-11-07 14:53:00+00:00,"@ewarren I greatly respect your commitment to finding ways to address wealth inequality and poverty at home. While we may disagree about some of the ways to get there, we certainly agree we need a lot of smart people committed to finding the path forward.",1192454910614196224,173,2337,Twitter Web App
2019-11-07 14:52:52+00:00,@ewarren You and the other candidates are having a really interesting conversation on how to solve some of the world’s toughest problems like eliminating global poverty and avoiding a climate disaster (though those issues don’t get talked about as much as they should).,1192454879454740481,179,2232,Twitter Web App
2019-11-06 01:53:00+00:00,One of the many awful things about watching someone you love struggle with Alzheimer’s is the feeling of helplessness. You keep thinking that there must be something more you can do. Here's one option. https://t.co/TQ1Z0lYCkN,1191896232643497984,1402,7829,Sprinklr
2019-11-01 14:29:31+00:00,"We have cut the number of child deaths in half over the last 20 years. New tools like these precision maps from 
@IHME_UW will help us cut child mortality in half again by 2030.  https://t.co/9XfRu6WuLK",1190274676330766339,612,4402,Sprinklr
2019-10-31 12:00:03+00:00,Buildings are one of the five areas where we need a lot of innovation if we’re going to avoid a climate disaster. I wrote about one company with a particularly clever approach. https://t.co/OXdxSChPCX,1189874673741381633,988,6371,Sprinklr
2019-10-30 16:30:01+00:00,"A lot of work remains, but it’s exciting to see positive data on a drug candidate that may alter the course of Alzheimer’s disease. https://t.co/h97EBGqWyJ",1189580223194509318,1322,9150,Sprinklr
2019-10-29 23:41:47+00:00,I always like to try out a new TV show or two when I’m on the road. What should I watch next? I set up an Ask on @Likewise to collect your recommendations. https://t.co/6Knu7M3wyO,1189326495900209152,259,2851,Twitter Web App
2019-10-29 17:00:58+00:00,"""This is a solvable problem."" @CarbonCure (which I’ve helped fund through @btenergy Ventures) has developed an innovative way to reduce cement's carbon footprint: https://t.co/9gvmkPGtnT https://t.co/zaqUc3In6R",1189225626919530496,839,4540,Twitter Media Studio
2019-10-27 12:23:00+00:00,One of the best parts of my job is getting to work with some of the world’s most brilliant minds on seemingly intractable problems. Here’s how we’re trying to tackle one of the defining technical challenges of our time. https://t.co/F2Wd8vM4ia,1188430895960743938,746,6982,Sprinklr
2019-10-25 14:14:36+00:00,This is one of the most important topics in medicine today: how can we make data more readily available for researchers to look for patterns and identify new pathways for treatment. https://t.co/hcji8sAhmy,1187734206144753664,1273,6958,Sprinklr
2019-10-24 18:34:28+00:00,The world has made incredible progress toward the goal to #endpolio thanks to partners like @MohamedBinZayed and the UAE. https://t.co/80j0A3MyJg,1187437217771225088,1227,4196,Twitter Web App
2019-10-23 23:00:00+00:00,"Melinda and I feel pressure to make every dollar and every day count, which is why we say no to a lot more opportunities than we say yes to. Working with partners around the world to #EndPolio has been a fight worth every dollar. https://t.co/a3gcP3M2HV",1187141652835721216,1089,9979,Sprinklr
2019-10-23 20:45:00+00:00,Tackling the world’s toughest health challenges requires the best that science has to offer. Thank you to @NIHDirector and @WHOAFRO for your partnership. https://t.co/85nrN9FFS2,1187107678050574337,455,3374,Sprinklr
2019-10-22 14:05:00+00:00,"Congrats to the 2019 winners of the @NobelPrize in chemistry! Few inventions have changed our lives as much as the battery, and the quest to build a better one is an important step in the fight against climate change. https://t.co/8XrKz2Zw1s",1186644627853598721,837,5452,Sprinklr
2019-10-21 11:53:00+00:00,"Malnutrition is the single greatest health inequity in the world. In its 2019 State of the World’s Children report, @UNICEF takes a critical look at how we can help everyone reach their full potential by improving access to nutrition. https://t.co/rpwu3XuuGt",1186249019393302529,1326,6447,Sprinklr
2019-10-20 23:10:00+00:00,The world’s poorest people often rely on farming both to feed their families and to earn an income. They will be among the first to face the effects of climate change. I’m excited about innovations aimed at addressing this problem: https://t.co/H7KrSXFo4b https://t.co/1QJg3gyJZY,1186057003686219781,1676,8158,Twitter Media Studio
2019-10-19 17:05:00+00:00,"Congrats to Esther Duflo, Abhijit Banerjee, and Michael Kremer for winning this year’s @NobelPrize in economics. I’ve learned a lot from their pioneering work to better understand the complexities of the lives of the world’s poorest people. https://t.co/Uc0XeytGRs",1185602762127613952,865,5857,Sprinklr
2019-10-18 20:00:00+00:00,"The world is facing a crisis at the dinner table, one that climate change will only worsen. I’m optimistic about the progress being made by @RIPEproject on a much-needed breakthrough. https://t.co/pzM61gDdWE",1185284415246753793,661,4449,Sprinklr
2019-10-15 19:58:30+00:00,The odds of dying of AIDS in South Africa are less than half what they were at the peak. That progress wouldn’t have been possible without the @GlobalFund and other global health organizations. Even more progress is possible if we keep up the fight: https://t.co/71W2exSVZT https://t.co/f2gJwuIb9H,1184196873877413888,541,3726,Sprinklr
2019-10-12 19:14:19+00:00,We need more approaches to stopping #Alzheimers disease. I’m excited to see this news out of @DZNE_de and @ISD_Research about a promising starting point for the development of new therapeutic strategies. https://t.co/zj81EbL7X6,1183098590253764608,1053,6476,Sprinklr
2019-10-11 20:00:00+00:00,I’m impressed by the international cooperation that made this year’s @GlobalFund Replenishment round possible. The world has committed more than ever before. Our foundation is proud to commit $700 million to over the next 3 years. #StepUptheFight https://t.co/mfuamNyygd,1182747700548329472,470,3991,Sprinklr
2019-10-11 18:00:40+00:00,"I can’t think of a more fitting tribute to Hans Rosling and his life’s work. Hans was a dear friend to Melinda and me – and inspired us all with his passion, intelligence, and wit. https://t.co/gYfioNQBuW",1182717669755293696,371,3636,Sprinklr
2019-10-10 17:04:48+00:00,"I’m in Lyon, France for the @GlobalFund’s replenishment – celebrating the most money ever raised for their life-saving work. I’m excited for the day that these diseases are in the history books. #StepUptheFight https://t.co/isnpGkyNWE",1182341221303275520,519,4410,Twitter Web App
2019-10-09 20:09:03+00:00,"In Afghanistan, one of the last countries with polio, vaccine acceptance rates have reached 98% thanks to the tireless work of female health workers. Their increased involvement and passion is why polio eradication is within reach in Afghanistan. https://t.co/v2yPVeSCiz",1182025200658984960,914,6756,Sprinklr
2019-10-09 14:45:36+00:00,"If all countries in the world had the same concentration of researchers as wealthy ones, there would be 3x as many researchers. That’s mind-blowing. We all lose out when talent isn’t connected with opportunity. @OurWorldInData https://t.co/a9m56tDdLp",1181943800140324866,1945,8008,Sprinklr
2019-10-08 21:41:59+00:00,Malnutrition is the greatest health inequity in the world. I recently spoke with my friend @AlikoDangote about how we can use iodized salt to help kids gets the nutrients they need: https://t.co/PXp3WeJfEy https://t.co/qpQ51LWZuf,1181686200068800512,1669,7788,Twitter Media Studio
2019-10-07 18:26:53+00:00,"I’m lucky to have known Stephen Hawking — and he was as exceptional in person as you imagined he was. As remarkable as his contributions to physics were, his biggest accomplishment was inspiring the world to believe in the magic of science and research. https://t.co/FxiyzmBTuz",1181274713559052289,1807,14928,Sprinklr
2019-10-05 12:00:03+00:00,Here is the story of the day I knew what I wanted to do for the rest of my life and the influence of someone who’s been a critical guide along the way: https://t.co/KWOicXCab6 https://t.co/R62eDi82yG,1180452588640186369,737,7211,Sprinklr
2019-10-04 12:00:01+00:00,"@TheEconomist is right: climate change touches everything and everyone -- and, unfairly, the poor and marginalized have the most to lose. 

If you want to understand what can be done, I highly recommend you read this issue. https://t.co/3JZS3WsAzQ",1180090191358365696,382,826,Sprinklr
2019-10-02 16:24:38+00:00,Melinda's work on behalf of women and girls around the world inspires me every day. She's committing $1 billion over the next ten years to increasing women's power and influence in the United States. Because #EqualityCantWait. https://t.co/QHnPyAeN59,1179432009929768962,2240,19238,Twitter Web App
2019-10-02 05:29:00+00:00,"I’m delighted that @erna_solberg has re-upped Norway’s commitment to support the work of the @GlobalFund. I welcome her sustained leadership and partnership in the fight against AIDS, TB, and malaria. https://t.co/2NTVVpmEul",1179267012918464512,487,3844,Sprinklr
2019-10-01 19:48:30+00:00,"Most people know @AlikoDangote as Africa’s wealthiest man, but I know him as one of our foundation’s most impactful partners in improving health. Melinda and I are lucky to count him as a partner (and friend!) in our work. https://t.co/9Pk8seLGpi",1179120926010609664,6519,22426,Sprinklr
2019-09-30 16:23:00+00:00,More and more children are living to see their 5th birthdays. That’s because the world has made incredible progress in reducing child mortality. But progress has been uneven. We have more work to do to close the gaps across countries and within them. https://t.co/TaeiqkLD0U,1178706822498308096,1904,13079,Sprinklr
2019-09-27 14:20:02+00:00,It's really incredible how much time and effort goes into producing a documentary like the new @netflix series I participated in. I shared more about the experience on my blog: https://t.co/BgTeiguaFf https://t.co/UzqI251nxU,1177588711552409603,853,9758,Sprinklr
2019-09-26 18:36:38+00:00,Ending poverty and achieving the SDGs requires a whole-of-government approach. @ImranKhanPTI and @SaniaNishtar have shown leadership in developing a new anti-poverty strategy. #Ehsaas https://t.co/tbRNz4Gbf6,1177290900281520128,5505,18285,Twitter Web App
2019-09-25 19:34:32+00:00,".@sanchezcastejon’s commitment to the @GlobalFund reflects Spain’s leadership. At a time when more countries are turning inward, Spain is showing that we can’t back away from our commitment to fighting poverty and disease. https://t.co/H0ffOpSGr9",1176943084984242178,1375,4578,Sprinklr
2019-09-25 12:37:38+00:00,RT @gatesfoundation: The third annual #Goalkeepers19 event brings together a new generation of changemakers to accelerate progress toward t…,1176838168554786816,207,0,Twitter Web App
2019-09-25 04:46:29+00:00,"Sanitation is a difficult issue to take on because there are no easy solutions. Tonight we recognized the progress India has made on this issue through its Swachh Bharat program, under the leadership of @narendramodi. https://t.co/liTmmHl7ap",1176719600098013186,5254,25835,Twitter Web App
2019-09-24 18:33:35+00:00,"I had the privilege of meeting @DrElvisEze at last year’s Malaria Summit in London, and I was struck by his optimism about the fight against malaria. I think you’ll be inspired by his story. https://t.co/92006G0AtA",1176565357508780034,372,2579,Sprinklr
2019-09-23 19:00:00+00:00,I’m excited to see world leaders and climate advocates coming together to make progress at the UNGA #ClimateAction Summit. Working together we can prevent the worst effects of climate change. https://t.co/AHOwRfmk0i,1176209619804459009,1019,6051,Sprinklr
2019-09-22 14:10:11+00:00,I’ve always loved playing tennis. Maybe this is why. See more deleted scenes from the @netflix series about my life and read exclusive stories on my blog: https://t.co/bjWwDvqQkc https://t.co/HquaH9PrBc,1175774293294297088,688,6770,Twitter Media Studio
2019-09-21 12:23:00+00:00,"I am hopeful that we can substantially alter the course of Alzheimer’s disease. This World Alzheimer’s Day, join me in supporting Alzheimer’s research by watching and sharing @AlzResearchUK’s #SharetheOrange video with @SamuelLJackson. https://t.co/5Gl8hWHXtA",1175384932882907138,4258,12602,Twitter Media Studio
2019-09-20 19:45:31+00:00,The docuseries about my life and work is out today. I hope you’ll check it out on @netflix — and then read some of the stories that didn’t make the cut on my blog. https://t.co/G6BfXXK93I,1175133910956748801,1217,8703,Sprinklr
2019-09-20 11:53:00+00:00,Adapting to climate change requires support from governments and businesses to ensure those most at risk have the opportunity to thrive. A new report from @GCAdaptation lays out steps we can take to address this urgent issue. https://t.co/QWEGBqY3Vl,1175014995605774336,667,3645,Sprinklr
2019-09-19 23:38:52+00:00,The new docuseries that looks at my work is out tomorrow. I hope you check it out on @netflix. I can’t wait to hear what you think: https://t.co/1UXX3xEja5. https://t.co/ZortFamUF0,1174830244584230913,2843,15333,Twitter Media Studio
2019-09-19 16:27:01+00:00,"As governments invest more in primary health care systems, overall health outcomes improve. Here’s how: https://t.co/GqQ8EHynUP https://t.co/gBtqPBh8Vw",1174721566250360832,455,2713,Sprinklr
2019-09-18 18:13:32+00:00,Melinda and I started out ahead. But hundreds of millions of people around the world have to overcome hurdle after hurdle to be successful. Read about how advocates are working to even the odds for everyone: https://t.co/w0DQYCunTK https://t.co/NGmF01h66W,1174385982885584896,886,4815,Sprinklr
2019-09-17 21:57:01+00:00,Health and education are improving everywhere in the world. But the gap between countries’ progress can be enormous. Our foundation’s 2019 Goalkeepers report examines two of the biggest factors responsible for this inequality: https://t.co/TQjcnNbu2y https://t.co/FFIkp6Crzf,1174079837738287105,705,4593,Sprinklr
2019-09-12 16:07:00+00:00,The Lasker-Bloomberg Public Service Award is a well-deserved recognition of @gavi's life-saving work. Congratulations to all of the winners: https://t.co/Hvpw43o3jb,1172179815702704128,299,2913,Sprinklr
2019-09-10 17:51:31+00:00,"Congratulations @BradSmi and @CarolAnnBrowne! Your insights have never been more relevant, and I am glad others will have the chance to benefit from them too. https://t.co/zDBkZk5YnB",1171481339893149696,215,2370,Twitter Web App
2019-09-07 12:00:01+00:00,"Today, it’s difficult for researchers to diagnose #Alzheimers patients early enough to intervene. A reliable, easy and accurate diagnostic would be a game changer, and artificial intelligence could be the answer. https://t.co/M0FxOmUAX2",1170305718425137152,980,5988,Sprinklr
2019-09-07 01:29:54+00:00,"Here’s a remarkable statistic: Nearly 1.1 billion fewer people are living in extreme poverty today than in 1990.  But over 700 million still live on less than $2 a day. Six of them share their stories, their challenges, and their dreams for better lives. https://t.co/8zjsa5RiP7",1170147147746074625,1650,7965,Sprinklr
2019-09-04 16:39:17+00:00,"The fact that a quarter of the kids born on the planet don’t get the right food to develop is a mind-blowing tragedy. 

Our growing understanding of the microbiome will make this problem #solvable: https://t.co/IUI8I6EKxi https://t.co/fIf97bjwqL",1169288834137251845,1363,7297,Twitter Media Studio
2019-09-01 12:00:01+00:00,"Climate change is one of the toughest challenges facing the world. But don’t despair…

Scientists and entrepreneurs are working on some innovative solutions. Here are four that I’m excited about: https://t.co/WKwW0PccbI https://t.co/KEdegq2V0A",1168131391508373507,1162,6890,Sprinklr
2019-08-31 17:05:23+00:00,"Manufacturing steel is one of the largest sources of greenhouse gas emissions. Boston Metal is working to change this, and I’m excited about their approach: https://t.co/3xp7NCHPio https://t.co/RPX6TEy3J2",1167845853538603008,932,5144,Twitter Media Studio
2019-08-30 11:54:00+00:00,"Tuberculosis is still the leading infectious cause of death worldwide. To #EndTB, we need to continue to develop safer and simpler solutions. The FDA’s approval of a new treatment is a promising step in the right direction. https://t.co/dJQapVKgjW",1167405102547816450,838,5416,Sprinklr
2019-08-27 18:59:00+00:00,"Whenever I hear an idea for what we can do to keep global warming in check, I always ask this question: “What’s your plan for steel?” 

I know it sounds like an odd thing to say, but it opens the door to a very important subject. https://t.co/Oo20WYmkAZ",1166424894416007168,1514,7602,Sprinklr
2019-08-27 08:06:35+00:00,"Germany, Italy, and the European Commission have demonstrated great leadership with their commitments to the @GlobalFund. Thank you @BMZ_Bund, @GiuseppeConteIT and @EU_Commission. Your pledges will help protect the world’s most vulnerable from #AIDS, #TB, and #malaria. https://t.co/gfu5ovysf2",1166260706322321409,717,4108,Sprinklr
2019-08-26 21:35:00+00:00,"When I think about the world I want for my children, I know that #EqualityCantWait. When women and men can reach their full potential, everyone benefits: https://t.co/Yo2Ru84nBx",1166101764506099712,878,5081,Sprinklr
