Date&Time,Tweet,Tweet_ID,ReTweet_Count,Favorite_Count,Tweet_Source
2018-04-11 15:39:01+00:00,Genome editing is one of the most powerful technologies of the 21st century. It’s important that new tools such as CRISPR continue to be applied – subject to rigorous guidelines – so the world can continue to make remarkable progress. https://t.co/VVWY6RkCph,984093469487575040,1312,5768,Sprinklr
2018-04-10 18:05:06+00:00,"“You’re not alone.”

This simple phrase has helped HIV survivor Cacilda Fumo save hundreds of lives every year. https://t.co/4xDQZzJ9q2",983767844398694406,447,3844,Sprinklr
2018-04-09 16:49:21+00:00,Congrats to @henrytimms and @jeremyheimans  on “New Power.” Looks like an interesting read. https://t.co/P90Rzf4lBo,983386394222444544,220,2157,Twitter Web Client
2018-04-08 14:11:12+00:00,"What we need is increased government and private sector support. Creating a zero-carbon future will take time, which is all the more reason to get started now.",982984204727152640,502,3713,Twitter Web Client
2018-04-08 14:11:11+00:00,But I am more optimistic than he is. I think innovation—and the urgency brought on by climate change—will speed up the process when it comes to clean energy.,982984203519254529,284,2877,Twitter Web Client
2018-04-08 14:11:11+00:00,Smil is absolutely right that the transition to clean energy will not happen overnight. Here is a chart showing that energy transitions can take many decades. https://t.co/2vV4tB2E9Z,982984200931258369,220,780,Twitter Web Client
2018-04-08 14:11:10+00:00,Vaclav Smil is one of my favorite authors. I’ve read nearly all of his 37 books. This is an excellent overview of how Smil has helped shape how people (myself included) think about energy. https://t.co/FEOkVkVyaH,982984199685652485,975,5395,Twitter Web Client
2018-04-06 14:38:01+00:00,Ironman triathlete and polio survivor @mindadentler’s story is incredible. Her commitment to eradicating the disease that paralyzed her inspires me to keep fighting to #endpolio. https://t.co/MpldqyS1xS,982266178620932103,1098,7183,Sprinklr
2018-04-05 21:52:17+00:00,This is one of the most educational books I’ve ever read: https://t.co/6b6qd1k5Zc https://t.co/JUUgytq1BI,982013077464858624,1016,5139,Twitter Media Studio
2018-04-05 16:22:26+00:00,Congrats to John Hennessy and David Patterson on receiving the Turing Award. The tech industry owes a debt of gratitude to you both. https://t.co/dCyYd29qzf,981930069789761536,658,5097,Sprinklr
2018-04-04 14:03:22+00:00,"I can’t recommend Factfulness highly enough. Hans and two family members wrote it at the end of his life, and it’s a wonderful summary of everything he stood for. Here’s my full review. https://t.co/vwU2a21ZYW",981532684211052545,556,3012,Twitter Web Client
2018-04-04 14:03:21+00:00,I use this one all the time: “Big numbers always look big. Small numbers on their own are misleading… Always look for comparisons.” https://t.co/nl9VK3t2iP,981532681413390336,465,3163,Twitter Web Client
2018-04-04 14:03:21+00:00,"“Slow change is still change.” Extreme poverty has gone down by an average 2.5% per year in the last two decades. Over time, that adds up to a 50% drop. https://t.co/3lymk8bjgX",981532678645141504,296,1582,Twitter Web Client
2018-04-04 14:03:20+00:00,"“Give the system some credit.” It’s great to celebrate heroes (I do!). But there were heroes 1,000 years ago, and life was awful. Modernity—being able to flush the toilet and turn on the lights—is a miracle of systems plus heroes. https://t.co/c92VUmlbjP",981532675176505345,220,1263,Twitter Web Client
2018-04-04 14:03:19+00:00,"“Things can be both better and bad.” This is the heart of our foundation’s work. It’s bad that 5 million children die every year—but it’s better than it was, which is why I think it can keep improving. https://t.co/hcYm3u0kX1",981532672580190208,272,1528,Twitter Web Client
2018-04-04 14:03:19+00:00,"“Factfulness,” by the late Hans Rosling, is one of the best books I’ve read in a long time. It’s a great guide to thinking clearly about the world. Here are some of my favorite tips… https://t.co/0TfEtVqNof",981532669358911488,2467,11105,Twitter Web Client
2018-04-03 17:32:01+00:00,"It’s hard to pick up on progress if you divide the world into developed countries and developing countries. In his newly-released book, Hans Rosling offers a better framework. You can download a free excerpt here… https://t.co/lK4xtl4DeV",981222802635284480,984,4498,Sprinklr
2018-04-02 21:00:00+00:00,Good news: the world’s newest country reported zero cases of Guinea worm in 2017 and hasn’t had a case in 15 months. https://t.co/uOo4MMEtFm,980912758148489218,631,5607,Sprinklr
2018-03-31 12:00:01+00:00,"My family loved talking about this book at the dinner table, and I think yours will, too. https://t.co/vVqVFlTSG0",980052089337499649,776,6918,Sprinklr
2018-03-29 20:45:08+00:00,It was great to visit @MSFTResearch TechFest. I’m always inspired to see the incredible research the company is infusing into products. https://t.co/3YKHD8NFUJ,979459463278022657,529,6431,Twitter for Android
2018-03-29 16:53:12+00:00,"Thank you, @tmyerson, for your leadership and your contributions. You’ve made a lasting impact on Microsoft. I look forward to sharing many more Diet Cokes with you in the future. https://t.co/mi4yMwma6f",979401094831853568,370,3733,Twitter Web Client
2018-03-28 20:16:56+00:00,"I had a lot of fun at @bigbangtheory. Luckily, I packed an extra tie. https://t.co/dAS2O4ihus",979089980864724992,4732,35254,Sprinklr
2018-03-28 12:07:00+00:00,I was impressed and inspired by the way Pete Peterson brought together brilliant people to take on tough problems like health care in the U.S. and nuclear proliferation around the world. I learned a lot from Pete and will miss him. https://t.co/Df3rGdDISa,978966684085125120,369,3604,Sprinklr
2018-03-27 21:59:56+00:00,My daughter Phoebe and I love reading all kinds of books and are big fans of @johngreen. Here are her (and my) thoughts on his latest book: https://t.co/hRCvwf2T6N https://t.co/b7lpFsAK8c,978753511591686144,1360,17105,Sprinklr
2018-03-27 17:20:03+00:00,"Energy innovation is not a zero-sum game. That’s why our clean-energy investment fund @btenergy is partnering with governments, companies, and other investors to drive innovation broadly. https://t.co/vZWtaWWEhE",978683079387729922,441,3060,Sprinklr
2018-03-27 16:13:18+00:00,"Great visit to Nigeria and Chad with my friend @AlikoDangote this week to talk about the importance of eradicating polio, getting life-saving vaccines to children, and improving primary healthcare. https://t.co/Gfz4ULjAVu",978666278297587713,2669,13949,Twitter Web Client
2018-03-26 22:08:24+00:00,Grateful to @ProfOsinbajo for his initiative in convening the National Economic Council on investment in people—and for the government’s openness and commitment to discussing how to build a Nigeria where all can thrive. https://t.co/LugM8HWacz,978393256592470016,2498,8368,Twitter Web Client
2018-03-26 20:11:28+00:00,I was excited to visit Nigeria and meet with @MBuhari and @ProfOsinbajo to discuss the country’s development goals. We agreed that Nigeria’s bright future will benefit from further investment in the country’s greatest resource: its people. https://t.co/ndH3xRVxQr,978363829536006146,7838,24118,Twitter Web Client
2018-03-23 16:34:30+00:00,Companies in Nigeria are taking a big step to end stunting and malnutrition. This commitment will build healthier and more prosperous communities. https://t.co/iYhdt9SMiU,977222062807834624,1385,5212,Twitter Web Client
2018-03-22 21:05:29+00:00,I’m hopeful we can alter the course of Alzheimer's if we invest in research to better understand how the disease unfolds. #ShareTheOrange is a promising new campaign to support Alzheimer’s research. @ARUKnews https://t.co/E7BJ3U5VMF,976927872773382144,2920,8812,Twitter Media Studio
2018-03-22 16:43:02+00:00,Strong health systems promote strong economic growth. Nigeria’s investments in its communities will yield benefits for years to come. #ImagineNigeria https://t.co/ftew1CjWsG,976861821423575044,2174,5511,Twitter Web Client
2018-03-16 16:53:26+00:00,Advances in agriculture can have a big impact on the lives of the world’s poorest. I’m particularly excited about new research from the @RIPEproject. https://t.co/1HWS1NIiJX,974690113144881152,968,4933,Sprinklr
2018-03-15 19:01:25+00:00,Superintendent Jorge Aguilar uses data to make a difference in the lives of students in Sacramento. We talked about how his own experiences have played a big role in shaping his approach: https://t.co/mPpyfMv3x6 https://t.co/a7wfliF5Gj,974359932412686336,632,4370,Twitter Media Studio
2018-03-14 20:05:26+00:00,"Developing affordable, clean energy for all is one of the smartest public investments our country can make. We need lots of innovation to get there, and @ARPAE is leading the way: https://t.co/thKFCIsq6o #ARPAE18",974013655443386368,719,4253,Twitter Web Client
2018-03-14 17:44:46+00:00,I feel lucky to have known Stephen Hawking. His work is an inspiring reminder of what human minds are capable of.,973978254045470721,5043,45331,Twitter for Android
2018-03-13 20:40:00+00:00,"I often meet with educators who have creative ideas about how to make school systems work for every child. Recently, I chatted with Superintendent Jorge Aguilar about how his district is improving outcomes for students. https://t.co/eGkhxMoMfy",973659967231275008,952,6677,Sprinklr
2018-03-11 20:09:51+00:00,RT @melindagates: Join us at #sxsw for a conversation about how we can make our workplaces work better for everyone. Watch live at 2 pm CT.…,972927603542671362,228,0,Twitter for Android
2018-03-09 13:46:00+00:00,I can always count on my friend Warren Buffett to give good advice. His latest annual letter to shareholders has great tips for investing your money wisely. https://t.co/DoR9ZD80ZX,972106228313853952,1385,6821,Sprinklr
2018-03-08 23:16:58+00:00,"Being an optimist doesn't mean you get complacent. It means you constantly look for ways to make the world better. This is a great conversation with @EasterbrookG about his new book, “It’s Better Than It Looks.” https://t.co/ou4UdXuqnU",971887530701479936,700,3545,Sprinklr
2018-03-08 15:13:11+00:00,"The evidence is clear: if you want to empower women and girls, give them the power to decide what to do with their own money. #IWD2018 https://t.co/YO5gJ6f7Zl",971765781729087488,2700,11718,Sprinklr
2018-03-08 02:23:02+00:00,Tomorrow is #IWD2018 — a day when the world celebrates the progress made by and for women. I’m inspired by Ellen Johnson Sirleaf. She was recently awarded the Ibrahim Prize for Achievement in African Leadership. https://t.co/4duvTvu2a5,971571964929245184,976,5652,Sprinklr
2018-03-06 21:41:00+00:00,"Most people know @rogerfederer as one of the greatest tennis players of all time. But his work off the court is also impressive. If you’re a Federer fan, I encourage you to read his recent post about his journey from tennis player to philanthropist. https://t.co/yTJiBe5AGK",971138602339061760,5105,23377,Sprinklr
2018-03-06 01:04:18+00:00,"Proud to be on Team Fed. We’re ready for you, @SavannahGuthrie and @JackSock: https://t.co/tUifhNNBVO #MatchForAfrica https://t.co/BMyYpUEmYl",970827375721070592,856,8003,Twitter Web Client
2018-03-05 17:00:17+00:00,Everyone benefits when women can fully participate in the economy. https://t.co/yi0vu4cpUr,970705568489865218,2145,11618,Twitter Web Client
2018-03-04 18:46:16+00:00,The sun is the most plentiful source of renewable energy we have -- and the race is on to harness its power. https://t.co/qWt0LWwXbd,970369856087326720,2377,11176,Twitter Web Client
2018-03-01 17:08:49+00:00,"As @KofiAnnan writes, cutting-edge mapping efforts have helped us understand the burden of health and nutrition disparities within African countries. These maps will enable us to reach the people who need help the most. https://t.co/yO1LGcw8nY",969258166276866049,1310,6033,Twitter Web Client
2018-02-28 18:15:05+00:00,"See you on the court, @SavannahGuthrie! https://t.co/9k7Mf8Pb6I",968912453642825729,263,2712,Twitter Web Client
2018-02-27 19:00:37+00:00,I’m on @reddit right now if you want to ask me anything: https://t.co/HXMsI0lSK1 https://t.co/1UxthPgCjz,968561524280197120,501,3665,Twitter Web Client
2018-02-27 15:40:30+00:00,Here are 4 things I won’t be doing today… and one thing I will: https://t.co/HXMsI04hSt https://t.co/ojUrcXu8IU,968511164408885248,980,7100,Twitter Media Studio
2018-02-26 21:11:23+00:00,Does the world suck? Not as much as you might think. https://t.co/JM5KMeQbxb,968232045083213824,901,6564,Twitter Web Client
2018-02-24 17:21:31+00:00,"People today are living longer, healthier, and happier lives than ever before. I asked @sapinker to explain why. https://t.co/697JymQI5p",967449421238579201,3163,11233,Twitter Media Studio
2018-02-23 21:39:08+00:00,The idea that children shouldn’t die of malaria isn’t just our value. It’s a human value. Parents in every culture want their children to survive and thrive. That’s why our foundation partners with thousands of organizations to reach people where they are: https://t.co/wuBSOd8KfX https://t.co/Hgcwhg5OU7,967151865560363009,1446,9474,Twitter Web Client
2018-02-23 15:04:51+00:00,".@melindagates talks about the experience that opened our eyes to the inequities in the world, and the incredible progress that makes us optimistic about the future. https://t.co/YdO2roOUOY",967052643901227008,514,3288,Twitter Media Studio
2018-02-22 14:32:53+00:00,"At Microsoft, I got deep into computer science. At the foundation, it’s computer science plus biology, chemistry, agronomy, and more. I can’t imagine a better way to spend the bulk of my time: https://t.co/hXSmccCUlg #TBT https://t.co/5rtt3JsOxC",966682211083698176,1795,14149,Twitter Web Client
2018-02-21 15:10:29+00:00,"Last year, Melinda and I took a trip to Atlanta, Georgia. What we saw reinforced our belief that education is the best way to break the cycle of poverty, and made us think through other ways we could help: https://t.co/mDNjKYQCxc https://t.co/Xy5RqdLIoQ",966329283676270592,1129,8473,Twitter Web Client
2018-02-19 15:47:58+00:00,"Although there’s been some progress over the past decade, America’s public schools are still falling short on important metrics. In our Annual Letter, Melinda and I explore how we can meet that challenge: https://t.co/mWp7sHp44d https://t.co/HGu6c5rs7M",965613942771863552,720,4687,Twitter Web Client
2018-02-18 16:43:57+00:00,Although Melinda and I see a lot of disease and poverty in our travels—and many other big problems that need to be solved—we also see the best of humanity: https://t.co/4mnnK5rx47 https://t.co/wrBATwV6jc,965265643716030464,1330,12223,Twitter Web Client
2018-02-17 13:49:05+00:00,"As counterintuitive as it may seem, population sizes don’t go up as the world gets healthier. They go down: https://t.co/Zi4etAcE2p https://t.co/ayrpYCYl75",964859249212850176,3955,14698,Twitter Media Studio
2018-02-14 14:40:55+00:00,Melinda and I got a kick out of doing our first autocomplete challenge. We answer more tough questions in our Annual Letter: https://t.co/YO3taYNxIL https://t.co/8CyCBw0vo2,963785129737977856,725,5358,Twitter Media Studio
2018-02-13 17:05:52+00:00,I’m on Facebook Live with @melindagates and @Lin_Manuel to discuss why we’re more optimistic than ever: https://t.co/0HYN41wnIP https://t.co/JMtxezXNl4,963459219583365120,467,4632,Twitter Web Client
2018-02-13 10:03:28+00:00,"This is our 10th Annual Letter, and we’re marking the occasion by answering 10 tough questions that people ask us. https://t.co/MKVcpD9ZBZ",963352916877815808,1645,8029,Twitter Web Client
2018-02-07 14:46:28+00:00,"Today marks one year since our dear friend Hans Rosling’s passing. If you want to know more about Hans and his work, we recommend any one of his wonderful TED Talks. https://t.co/AQqcAnUCem",961249811096748032,1267,6778,Twitter Web Client
2018-02-05 14:45:18+00:00,You’re 37 times less likely to be killed today by a lightning bolt than you were at the turn of the 20th century – and that’s not because there are fewer thunderstorms: https://t.co/Z8r7jZQmgD https://t.co/dthXZg0yry,960524741772636160,1391,7198,Twitter Web Client
2018-02-02 18:39:17+00:00,I love stories like this… 14-year-old Emma Yang is developing an app to help bridge the gap between Alzheimer's patients and their loved ones. https://t.co/g0MpnI74Ad,959496458847141890,3291,15244,Twitter Web Client
2018-02-01 04:38:29+00:00,"Welcome to the Giving Pledge, @drshamsheervp. You approach philanthropy with the spirit of an entrepreneur and the passion of a humanitarian, and we’re happy to have you. https://t.co/XvkoAIX7v3",958922480646696960,379,3110,Twitter Web Client
2018-01-31 14:50:33+00:00,My family’s experience has exposed me to how awful it feels when a loved one is diagnosed with Alzheimer’s. I spoke with @mariashriver about what it will take to find a breakthrough. https://t.co/EQmxDGklxH,958714122014633985,1177,6984,Twitter Web Client
2018-01-30 20:38:39+00:00,I’ve spent a lot of time thinking about how the information we consume shapes our perception of the world. I’m glad we have brilliant thinkers like Steven Pinker to help us spot signs of progress: https://t.co/7jMdxQrGWX https://t.co/Qc1F1SsAst,958439338030714880,1410,6293,Twitter Media Studio
2018-01-30 14:58:53+00:00,"Since my early days as a programmer, I’ve been fascinated by computers. I was thrilled when @codeorg asked me to help them create a video series about how they work. https://t.co/SqgUi7HPfi",958353831410114560,1509,7557,Twitter Web Client
2018-01-29 15:06:07+00:00,I can’t wait for readers to get their hands on my new favorite book. You can download a free chapter of “Enlightenment Now” here: https://t.co/Br74reVdOq https://t.co/YfTehjA0SL,957993265311105024,1130,5948,Twitter Web Client
2018-01-28 15:51:36+00:00,"Congrats, @rogerfederer, on winning your 20th Grand Slam. Can’t wait to see your game up close on March 5 at the #MatchforAfrica.",957642322191138817,3371,30175,Twitter Web Client
2018-01-27 16:53:57+00:00,"I sat down with @sapinker and @SocialQPhilip to talk about Steven’s upcoming book, “Enlightenment Now.” I came away from the conversation with a renewed sense of optimism about the world: https://t.co/4nDnNx8LTf https://t.co/0Su52f8sOz",957295624835100672,526,4130,Twitter Web Client
2018-01-26 14:34:50+00:00,"RT @melindagates: This week, leaders from business and government are convening in Davos for #WEF18. I have a message for them: it’s time t…",956898226686148608,577,0,Twitter Web Client
2018-01-25 18:36:05+00:00,Playing tennis with @rogerfederer was one of my favorite parts of 2017. I can’t wait to team up with him again on March 5th for the next Match for Africa with @JackSock and @SavannahGuthrie: https://t.co/KwldVqExzN https://t.co/HGqixVCeun,956596552646066176,3050,12616,Twitter Media Studio
2018-01-25 06:50:04+00:00,"I’m optimistic that we’ll see an end to malaria in my lifetime. It’s a preventable and curable disease, and we’ve already demonstrated that progress is possible. Here’s what it will take to end malaria for good: https://t.co/6RQQ9Zt6Uj https://t.co/myMXg8nvHl",956418879420420097,2771,13464,Twitter Media Studio
2018-01-25 02:00:43+00:00,"Inspired by my conversation with two great leaders, @JustinTrudeau and Jack Ma. https://t.co/NifgVvMRHy",956346059839627264,2142,20970,Twitter Web Client
2018-01-24 16:55:25+00:00,"Welcome to the End Malaria Council, @JulieBishopMP. Australia has shown tremendous leadership in the fight against malaria, and I’m excited about what we can accomplish together: https://t.co/xbDneWSpUu https://t.co/azSimQkxRx",956208829737259008,629,5020,Twitter Web Client
2018-01-20 15:57:00+00:00,"Wise words from @Malala: “I think it’s pointless to be hopeless. If you are hopeless, you waste your present and your future.” https://t.co/6U97pTRQIC",954744577964912640,3311,13124,Twitter Web Client
2018-01-17 17:25:31+00:00,Millennials want to make a difference in the world. One of my favorite comedians @Trevornoah urges us to give them a chance. https://t.co/PMgDCTUWcg,953679691503755264,3083,9759,Twitter Web Client
2018-01-16 20:08:51+00:00,I’m excited to share my first #VR video of 2018. Travel with me to India and learn how the country wiped out polio within its borders: https://t.co/h5VKa9ZqRA https://t.co/TEPss43MIE,953358408635199488,1970,12887,Twitter Web Client
2018-01-15 16:00:43+00:00,"“I got arrested, beaten, left bloody and unconscious. But I haven’t given up. And you cannot give up.” An inspiring #MLKDay read from civil rights legend @repjohnlewis. https://t.co/PhJkRsDZ7x",952933573257977856,3264,13621,Twitter Web Client
2018-01-13 14:50:06+00:00,We’re closer now than we have ever been to eradicating polio. That’s why it’s more important than ever to support organizations like @Rotary that help polio workers on the frontlines of this fight: https://t.co/gPAiJgjxdP https://t.co/n3ckvzWbf8,952191028991221760,1779,9557,Twitter Media Studio
2018-01-12 20:58:45+00:00,"RT @MaxCRoser: .@NickKristof on global development and why it is important that we know that the world is making progress: ""The world is re…",951921415598456832,149,0,Twitter Web Client
2018-01-12 15:31:24+00:00,"Good news worth sharing… Thanks to vaccine innovation, countries will be able to protect millions of kids against typhoid: https://t.co/orXvbs4hQc #VaccinesWork https://t.co/6InsGO4J6p",951839031662280706,1544,7444,Twitter Web Client
2018-01-11 17:13:58+00:00,"Whenever someone asks me why I believe it’s possible to end polio, I tell them about this trip: https://t.co/nOwONIdhGr #TBT https://t.co/myNNEA9U4a",951502458089451522,1147,7733,Twitter for Windows
2018-01-11 00:05:25+00:00,"In 1988, there were 350,000 new polio cases. Last year, there were just 21. Here’s what made this progress possible: https://t.co/wpTTpyg0VF https://t.co/qW5chL09rl",951243612615880704,3507,17312,Twitter for Windows
2018-01-10 14:45:14+00:00,“When Breath Becomes Air” is one of the most moving books I’ve ever read. I’m glad things turned out okay for @rocketgirlmd. https://t.co/oIOGmMIcsB,951102637595754497,567,4176,Twitter Web Client
2018-01-09 17:50:54+00:00,My friend Bono explains the potential we could unlock if the gender gap in education was closed: https://t.co/umLRC4or0K #GirlsCount https://t.co/Fdf6lPOORe,950786977120509952,2331,7522,Twitter Media Studio
2018-01-09 00:06:09+00:00,I’m excited about the possibilities that exist at the intersection of global health and the private sector. I spoke about how companies can harness these opportunities earlier today. https://t.co/wd6Q6JBma4,950519022428176384,995,5418,Twitter Web Client
2018-01-08 03:01:17+00:00,"These are just a few of the many people using their talents to fight poverty, hunger, and disease. The world is a better place because of what they do: https://t.co/uDK0DSPXQB",950200707763683328,2017,10454,Twitter Web Client
2018-01-07 17:37:10+00:00,.@charlesjkenny is one of my favorite writers on the optimism beat. This article is a must-read. https://t.co/tlJ35odbW0,950058742267052032,470,3092,Twitter Web Client
2018-01-06 13:40:05+00:00,I sat down with TIME’s @nancygibbs to talk about what gives me hope about the world’s future: https://t.co/h6SNkrPbBj https://t.co/WeGfDJubxX,949636691068768256,730,4478,Twitter Media Studio
2018-01-05 17:55:57+00:00,"I first met Mohammed Nassir when he was only two weeks old. Today, he’s five years old and thriving—a testament to the incredible progress we’ve made to reduce child mortality in Ethiopia: https://t.co/giG3DKHVc0 https://t.co/5r6vKXHntq",949338696741826560,1380,11783,Twitter Web Client
2018-01-05 15:26:35+00:00,"RT @melindagates: I’ve said it before, and I’ll say it again: If we want to change the world, we should invest in the women who already are…",949301105946603523,2835,0,Twitter Web Client
2018-01-04 14:00:19+00:00,"I was excited when @TIME asked me to serve as its first guest editor. I asked some of the people I respect most to write about what makes them optimistic. I hope they inspire you, too: https://t.co/PlQu9kSHh6 https://t.co/XhdocOGRpi",948917010141929472,4276,19089,Twitter Media Studio
2017-12-22 15:55:14+00:00,I’m optimistic we can stop climate change and help those who are being hurt the most by it—all while meeting the world’s energy needs: https://t.co/hs5Ah6lPgW https://t.co/QzDFT7TjCR,944234884213620736,2260,10034,Twitter Media Studio
2017-12-20 17:36:45+00:00,Melinda and I have been working for some time to learn more about the challenges Americans face moving up the economic ladder. This book helped me understand what it’s like to be poor in the U.S. better than anything else I’ve read: https://t.co/inBzufT8pP https://t.co/I6x7ztXIhV,943535658923995137,1265,7228,Twitter Web Client
2017-12-19 21:43:48+00:00,"I appreciate how thoughtful my friend @RayDalio is about how he gives back. With every purchase of his new book, “Principles,” a $10 donation will be given to the charity of your choice. https://t.co/9vX3I8EF4I",943235443885187072,400,2829,Twitter Web Client
2017-12-19 14:51:27+00:00,"9/ These tweets made me feel better about 2017 and more optimistic about the new year. I hope they make you feel more hopeful, too. What tweets inspired you this year?",943131672014229509,801,7519,Twitter Web Client
2017-12-19 14:51:27+00:00,8/ Here’s my own extreme submission to the challenge. #extremereading https://t.co/z6Uk1cM5Cq,943131670202298368,594,6420,Twitter Web Client
