Date&Time,Tweet,Tweet_ID,ReTweet_Count,Favorite_Count,Tweet_Source
2023-03-02 21:52:54+00:00,"Thank you @amitabhk87 &amp; @g20org for the welcome. It was an honor to share the stage with @AshwiniVaishnaw, @UpasanaTaku, @ChapmanLizzie, &amp; @MabelChacko. We had an incredible discussion about how India's prowess in digital public infrastructure can be an inspiration for the world. https://t.co/hw7yz015Eu",1631412289193775110,94,1155,Twitter Web App
2023-03-02 21:35:59+00:00,Thank you Minister @HardeepSPuri for an engaging conversation on energy transition. We continue our commitment to support safe and sustainable sanitation. @MoHUA_India https://t.co/iLfAPjEgB3,1631408032453382145,146,1555,Twitter Web App
2023-03-02 21:25:36+00:00,"India is making strong progress toward a healthier future for women and children through POSHAN 2.0 with a focus on data &amp; monitoring. Today I met with two amazing administrators, Amy Joseph and Lakshmi Priya, who are helping to improve nutrition outcomes. @MinistryWCD https://t.co/zFoQUChHPk",1631405419406163969,204,1811,Twitter Web App
2023-03-01 22:24:17+00:00,It was great to visit the Indian Agricultural Research Institute and learn about the advanced technologies being used to develop climate-smart crops in India. I am thrilled to see India make progress on innovations that can help farmers globally. https://t.co/bHji4HzLzW,1631057799466610688,884,11801,Twitter Web App
2023-03-01 21:48:55+00:00,India’s health infrastructure has grown tremendously since my last visit here. It’s great to see so much progress made toward building an inclusive and accessible healthcare by @MOHFW_India and @mansukhmandviya. We're glad to be a part of this journey toward a healthier India. https://t.co/XGJDTZUJ5V,1631048900122640384,246,1980,Twitter Web App
2023-03-01 20:47:21+00:00,India is a global pioneer in building and scaling digital public infrastructure. @AshwiniVaishnaw and I talked about the progress of @_DigitalIndia. This is India’s moment to lead the adoption of digital services across the development sector globally. https://t.co/dCkVy8kmsY,1631033404744687616,329,3227,Twitter Web App
2023-03-01 20:09:29+00:00,"India is creating positive change through innovative digital programs like CoWIN, #ABDM, and #ONDC. I had an insightful conversation with @Rajeev_GoI on strengthening digital capacity within the government with a renewed focus on health, agriculture, and women's power. https://t.co/RCV8Id1CWX",1631023875449565184,121,1350,Twitter Web App
2023-03-01 20:08:38+00:00,"RT @PrinSciAdvOff: Mr. @BillGates, Co-Chair and Trustee @gatesfoundation called on Prof Ajay K Sood, @PrinSciAdvGoI. The discussion focused…",1631023662555070470,79,0,Twitter Web App
2023-02-28 23:43:22+00:00,"I had a great time learning more about your work in children's healthcare. I’m optimistic that, working together, we can score a century for progress! https://t.co/JAPnjBQIwk",1630715311975723008,333,6107,Twitter Web App
2023-02-28 16:31:41+00:00,"It was a pleasure to meet with @anandmahindra and discuss our efforts to increase women's economic power in India. We talked about opportunities to collaborate on areas like agriculture, digital financial services, and climate. https://t.co/U3YtYXKsp1",1630606674280189953,233,3217,Twitter Web App
2023-02-28 09:22:14+00:00,"RT @RBI: Mr.@BillGates visited RBI Mumbai today and held wide ranging discussions with Governor @DasShaktikanta 
 
#RBI #rbitoday #rbigover…",1630498603151298560,327,0,Twitter Web App
2023-02-27 17:56:34+00:00,"Like every other country on the planet, India has limited resources. But it has shown us how the world can still make progress in spite of that constraint. https://t.co/9vcQsBw5Ou",1630265649875517442,466,3716,Twitter Web App
2023-02-25 21:36:04+00:00,"RT @_HannahRitchie: 99% of the Indian population has access to electricity.

In 2000, this was just 59%. Even in 2010, just 76%.

A massive…",1629596113153187840,2120,0,Twitter Web App
2023-02-24 23:14:03+00:00,"I spent the morning in DC celebrating 20 years of @PEPFAR which has helped save more than 25 million lives, and is one of the most generous initiatives America has ever led. https://t.co/pEgJyUbCQs",1629258382992621568,235,1637,Twitter Web App
2023-02-24 18:10:22+00:00,Recent Alzheimer’s breakthroughs like lecanemab will spark new and increased investment in brain health — giving hope that we’ll someday soon be able to substantially alter the course of the disease and ones like it. https://t.co/szd2m8nuDj,1629181957509902338,216,1580,Twitter Web App
2023-02-22 20:10:22+00:00,"India gives me hope for the future. I’m excited to visit next week and see the work being done by innovators and entrepreneurs to tackle big challenges like climate change, health, and hunger. https://t.co/vnVpLNROtZ",1628487382742798337,363,2433,Twitter Web App
2023-02-22 20:08:18+00:00,"RT @Breakthrough: At #MSC2023, BE joined @Siemens_Energy, @vonderleyen, @wernerhoyer, @fbirol &amp; others to launch the Energy Resilience Lead…",1628486860996743169,108,0,Twitter Web App
2023-02-18 01:26:40+00:00,"The world is facing multiple crises around energy, food and health. These threats are interconnected and require a joined-up response, prioritizing global cooperation and innovation. https://t.co/KcVdDV2jqC",1626755042454933505,369,2122,Twitter Web App
2023-02-17 15:43:25+00:00,.@RishiSunak and I were interviewed by an AI chatbot and had a great conversation about the future. Spoiler alert: it’s bright. https://t.co/PZ5TgaumVn,1626608263403016195,220,1472,Twitter Web App
2023-02-15 18:04:32+00:00,"I enjoyed speaking in Oslo about the interlinked challenges of energy, health, and food security and the way forward in this time of crisis. https://t.co/cGFqZLlReH",1625919001628135425,287,2488,Twitter Web App
2023-02-15 08:40:49+00:00,Norway has been a great supporter of global health in low-income communities through ODA contributions. It was great to connect with @jonasgahrstore on this. https://t.co/u6BFKz1Og8,1625777138279542786,146,1241,Twitter Web App
2023-02-15 04:40:22+00:00,"Congratulations to @gavi’s next CEO, @Muhammadpate. I have no doubt he will bring learnings from his impressive career in Nigeria and at the @WorldBank to ensure children have access to lifesaving vaccines. https://t.co/oM9GFu4V4Z",1625716626862796801,174,1203,Twitter Web App
2023-02-10 16:58:14+00:00,"Thank you, @libbycave and the BBC team. I really enjoyed my conversation with Amol in Kenya and am honored to be in the company of such fascinating people. https://t.co/glBO3aMBq8",1624090375387496448,153,925,Twitter Web App
2023-02-09 01:24:18+00:00,Super inspiring. https://t.co/XZtiHMr8kC,1623492955414867968,265,1843,Twitter Web App
2023-02-08 03:22:52+00:00,"RT @GatesUS: Thanks to 20 years of bipartisan support, @PEPFAR has been a game-changer in the fight against HIV/AIDS.

25 million lives sav…",1623160408831066119,103,0,Twitter Web App
2023-02-06 20:02:02+00:00,CRISPR has revolutionized health over the past decade. I’m excited to see how it will continue to evolve and intersect with other technologies in the decade to come. https://t.co/q2m1ETeH7C,1622687080018214912,353,1816,Twitter Web App
2023-02-03 17:02:40+00:00,My first job was writing software for the entity that controls the power grid in the Northwest. Extreme weather has made it clear grids are a lot more vulnerable today than they were back then. https://t.co/ILs8daiXsg,1621554774998138880,373,2413,Twitter Web App
2023-02-02 16:44:41+00:00,"Aside from being a neat piece of art, the periodic table reminds me of how one discovery can lead to countless others. https://t.co/dmrQWVeyyk",1621187863143682049,481,4520,Twitter Web App
2023-01-31 19:11:54+00:00,"In Kenya, I visited with a smallholder farmer using new tools and practices to fight back against climate change: https://t.co/JZ6NXGvo8x https://t.co/gXyBuZWlyw",1620500134164594688,493,3215,Twitter Media Studio
2023-01-30 17:25:42+00:00,"RT @gatesfoundation: As of 2022, 47 countries have eliminated at least one neglected tropical disease (NTDs).

A new report from @WHO shows…",1620111020634308616,145,0,Twitter Web App
2023-01-27 18:53:07+00:00,Thank you for your support and continued leadership. https://t.co/2G7A1enK95,1619045855784480768,218,1413,Twitter Web App
2023-01-25 18:21:01+00:00,Transmission is critical to unleashing the potential of affordable and abundant clean energy: https://t.co/NJWWkaWD36 https://t.co/jzfiX7wZp5,1618313002385813505,466,2647,Twitter Web App
2023-01-24 22:37:44+00:00,"It was a pleasure to speak at the Lowy Institute about how climate change is inextricably linked with health, food, and energy security. These must be addressed together with an understanding about how each one impacts the others. https://t.co/4CEaG6rphR",1618015218688462848,274,1751,Twitter Web App
2023-01-24 22:33:54+00:00,"Prime Minister Kishida is right: Building resilient health systems means investing in R&amp;D before crises emerge, improving primary health care, and strengthening the emergency response health workforce. Grateful for Japan’s strong leadership as head of the @G7. https://t.co/wviqHpb0Rh",1618014255399448577,140,828,Twitter Web App
2023-01-23 17:22:17+00:00,"In his annual letter, CEO @MSuzman explains how the @gatesfoundation uses its dollars and voice to help find solutions for problems that otherwise might be neglected. https://t.co/yULE6iMTOa",1617573445751164929,189,1328,Twitter Web App
2023-01-21 02:42:34+00:00,"What a great meeting with @AlboMP on the intersection of climate, energy, and health. We also spoke about supporting communities in Australia and across the globe as the world adapts to the changing climate. https://t.co/R878IQZL2u",1616627283711889408,331,2486,Twitter Web App
2023-01-17 17:28:48+00:00,RT @MSuzman: Overlapping crises are rolling back a decade of progress in global health and development &amp; have taken a severe toll on the wo…,1615400759662891008,182,0,Twitter Web App
2023-01-12 18:19:23+00:00,".@Rotary has been leading the charge to #EndPolio for decades. Now, with the finish line in sight, they are ensuring that polio stays a global priority. We also remain committed, tripling every donation made to Rotary. https://t.co/GeBKF8KmYd",1613601550345338881,340,1635,Twitter Web App
2023-01-11 20:30:36+00:00,I’m live on @Reddit now. Ask me anything: https://t.co/pGYLckOrL6 https://t.co/fCK8b2MdHM,1613272185342414848,549,4994,Twitter Web App
2022-12-20 05:31:28+00:00,"I am in awe of people who have dedicated their lives to making the world a more equitable place, and I feel lucky to be able to support their efforts. https://t.co/It4s0WRzH5",1605073375151656960,942,5395,Twitter Web App
2022-12-16 20:53:09+00:00,You don’t need to be a big soccer fan to recognize why it’s called “the beautiful game.” https://t.co/Bkiar7eYUu,1603855776053100545,396,2537,Twitter Web App
2022-12-16 20:51:53+00:00,"RT @gatesfoundation: This is a major milestone in the fight against #malaria. Now, millions more people have access to a powerful new tool…",1603855454995898368,198,0,Twitter Web App
2022-12-16 20:32:41+00:00,"RT @AP: The major advance in fusion research announced on  Tuesday was decades in coming, with scientists for the first time able to engine…",1603850624340488192,206,0,Twitter Web App
2022-11-19 19:24:57+00:00,"In order to solve our world’s sanitation crisis, we need smarter toilets that don’t rely on sewage systems and prevent the spread of diseases. #WorldToiletDay https://t.co/gbp9F0GxlE",1594049106615291907,898,5344,Twitter Web App
2022-11-18 20:52:59+00:00,"Collaboration and more open access to data have made seemingly impossible health breakthroughs a reality, like COVID-19 vaccines. @AlzData is putting the power of data behind one of our most critical health challenges. https://t.co/Qtatf2WMds",1593708872291663872,375,1684,Twitter Web App
2022-11-18 18:51:11+00:00,"From decreasing maternal mortality to lowering rates of vaccine-preventable diseases, @WendoAszed is a true hero in her community. https://t.co/tuAz440QNx",1593678220645511168,293,1782,Twitter Web App
2022-11-17 20:27:13+00:00,"Africa has always been at the heart of our foundation’s mission. Today, we are announcing our commitment of $7 billion over the next 4 years for the development of more breakthrough innovations in health and agriculture across the continent. https://t.co/imh57I2hdg",1593340000149549056,505,2630,Twitter Web App
2022-11-17 20:05:19+00:00,@Amref_Worldwide is doing great things for health within Kenya and across Africa thanks to the leadership of @daktari1. It was a pleasure to meet with you. https://t.co/qTDcW0N0hF,1593334489656139779,39,270,Twitter Web App
2022-11-17 19:07:18+00:00,Many people don’t know that Mike was a champion for and leader on PEPFAR – the President’s Emergency Plan for AIDS Relief – which has saved millions of lives. It’s one of the best things this country has ever done. It will be a lasting part of his legacy.,1593319886763139072,148,1216,Twitter Web App
2022-11-17 19:07:17+00:00,"I’m very sad to hear about Michael Gerson’s passing. We spoke many times over the years, especially about global health, and when I started talking about pandemic prevention back in 2015, he was one of the first journalists I wanted to talk to. https://t.co/1MUgLtwhi1",1593319884439490561,274,1906,Twitter Web App
2022-11-17 18:36:48+00:00,"@KenyaGovernors @gatesfoundation It was a pleasure to join this roundtable to learn more about Kenya’s progress. It is great to be back in Kenya. So much has changed since my last visit, and it’s exciting to come and see it first-hand.",1593312213258772481,10,36,Twitter Web App
2022-11-16 20:55:31+00:00,RT @Africa_com: https://t.co/p2DkutFiFM is excited to host Bill Gates in an exclusive conversation for the https://t.co/p2DkutFiFM virtual…,1592984733906259968,265,0,Twitter Web App
2022-11-16 20:18:54+00:00,"I’m in Kenya this week to learn from researchers, innovators, students, and leaders about what’s working, what’s not, and how the foundation can better support progress in Kenya and across the continent. https://t.co/FrWWrRYCA6 https://t.co/VVe4w3ZkT1",1592975520312225793,1948,18404,Twitter Web App
2022-11-16 19:36:58+00:00,Thank you for having me. I’m excited to be here in Kenya this week to see how much progress has been made. https://t.co/AE84KokmEO,1592964968252854272,549,5246,Twitter Web App
2022-11-16 19:34:34+00:00,"@OfficialMakueni Thank you. I enjoyed learning from your health team, as well as some of the remarkable individuals who make up the community.",1592964362121392128,12,34,Twitter Web App
2022-11-15 18:55:28+00:00,"I believe everyone has a role to play in addressing climate change. Whether you’re an entrepreneur, an inventor, or consumer, we can all help avoid a climate disaster. https://t.co/qlLNjgq2XD",1592592132694757376,507,3050,Twitter Web App
2022-11-14 02:24:53+00:00,"When it comes to alleviating the impacts of #climatechange on smallholder farmers, the goal should not simply be giving more food aid. It should be to ensure no aid is needed in the first place. https://t.co/POXDnJo0tN #COP27",1591980459667656705,334,2175,Twitter Web App
2022-11-12 23:37:19+00:00,Those of us who have done the most to cause this problem should help the rest of the world survive it. We owe them that much. https://t.co/H4dLsGFelO,1591575900843569152,451,2605,Twitter Web App
2022-11-12 16:38:54+00:00,"More than 670,000 children die from pneumonia every year. Inventprise is working to change that. #WorldPneumoniaDay https://t.co/b84FmxsOxA",1591470604267696130,296,2052,Twitter Web App
2022-11-10 22:00:16+00:00,"While the last steps are proving to be the toughest, I’m optimistic we will eradicate polio. I recently visited @KU_Leuven’s Rega Institute where they’re testing preventative medicine – an important step toward a polio-free world. https://t.co/VOiM8Yla5I",1590826702502236160,282,2656,Twitter Web App
2022-11-07 23:38:09+00:00,"The climate crisis is already devastating communities. More funding is necessary to ensure agricultural and technological innovations are widely available to the most vulnerable, helping them adapt to climate change, save lives, and increase economic opportunity. https://t.co/KvQAM73myZ",1589764171021037568,320,2056,Twitter Web App
2022-11-04 16:49:54+00:00,I have never met anyone who was more passionate about reducing the world’s worst inequities in health than Paul Farmer. I continue to learn from my dear friend’s life and legacy today. https://t.co/Mk3HFoiqEn,1588574269226688512,254,2040,Twitter Web App
2022-11-03 21:47:29+00:00,"More than 1B people globally still suffer from #NTDs, many caused by parasites. I got a firsthand look at these creepy crawlies at the Parasitic Museum in Tokyo. The more we understand them, the better we can address the diseases they cause. https://t.co/jDjFYCFVgv",1588286769719808001,223,1876,Twitter Web App
2022-11-03 17:09:17+00:00,"This year's #BESummit2022 brought together investors, policymakers, and innovators to tackle one of the world’s toughest problems: climate change. https://t.co/nZ4SWXKrhk",1588216758175162368,243,1710,Twitter Web App
2022-10-28 16:42:42+00:00,"Math shouldn’t be a gatekeeper, limiting a student’s dreams. It should be a gateway, helping students realize them. https://t.co/YjFMqGn5yz",1586035739229270016,525,3581,Twitter Web App
2022-10-27 19:28:33+00:00,"TerraPower, the next-gen nuclear company I founded, just agreed with PacifiCorp to study the feasibility of building five Natrium reactors for its customers. https://t.co/S6F0ALOnFO",1585715089394782209,363,2799,Twitter Web App
2022-10-26 21:13:42+00:00,I had a great meeting with @starkwatzinger to discuss the importance of funding research to address some of the future challenges we face in global health. https://t.co/vLDqt4SBpn,1585379166349889542,157,1176,Twitter Web App
2022-10-26 21:13:19+00:00,"Thank you, Prime Minister @Xavier_Bettel for your continued commitment and support. https://t.co/AyXnm7ThA6",1585379068505370624,139,1407,Twitter Web App
2022-10-26 15:44:32+00:00,I am thrilled to see the existing partnership between @EIB and @Breakthrough strengthen with the signing of this MOU today. Global collaboration like this has the power to bring the clean energy solutions we need to communities around the world. https://t.co/YIzvV6G7Jg,1585296325989453824,165,1245,Twitter Web App
2022-10-26 11:59:36+00:00,"I’m deeply grateful for the efforts of partners like President @MohamedBinZayed who have helped reduce the global polio burden by 99.9% and prevented an estimated 20 million children from being paralyzed. Together, we can overcome the last hurdles and achieve a polio-free world. https://t.co/eD5ao7EBA0",1585239719457103872,449,1889,Twitter Web App
2022-10-25 23:37:29+00:00,Testing for viruses with a breathalyzer? It’s possible. Pretty incredible to see the innovative work happening at @imec_int. https://t.co/wRMLvd7Gk0,1585052961511976960,363,3231,Twitter Web App
2022-10-25 23:31:16+00:00,"Thank you, Prime Minister @alexanderdecroo, for hosting this year’s #GrandChallenges meeting. Your support in facilitating this gathering of global leaders will help ensure a healthier and more secure world. https://t.co/2ZEOEaTV04",1585051398043242497,140,1357,Twitter Web App
2022-10-25 21:48:17+00:00,@CovariantAI Thanks for having me! Seeing the universal Al Robotics platform in action was incredible.,1585025479416766469,6,103,Twitter Web App
2022-10-25 21:46:51+00:00,@VDombrovskis @gatesfoundation Thank you for the thoughtful discussion.,1585025119906590720,4,19,Twitter Web App
2022-10-25 21:44:52+00:00,"One amazing program supported by the EU and @gatesfoundation together is the African Medicines Agency, a new African Union institution to strengthen regulatory capacity and health security across the continent. https://t.co/aqAcFQQ6Ji",1585024621950431232,68,623,Twitter Web App
2022-10-25 21:44:52+00:00,Thanks to the @EU_Commission’s @ratsosi for a great discussion about our joint efforts to advance the fight against infectious diseases. https://t.co/3dvZz5c7ut,1585024619710291968,174,1756,Twitter Web App
2022-10-25 13:57:58+00:00,"Twenty years ago, I thought of #GrandChallenges as a Gates Foundation initiative. Because of all of the innovators and broader scientific community involved, it has become a global movement. https://t.co/I9rWMg5bTa",1584907122755633153,181,1641,Twitter Web App
2022-10-21 21:43:00+00:00,It’s been fantastic to learn from @djimdeab and @Ioyier who've been working on the reduction of malaria and many other disease elimination programs with the support of @wellcometrust. https://t.co/uyHw3zgZvc,1583574597618012161,163,1231,Twitter Web App
2022-10-20 18:27:43+00:00,"To understand what it will take to get to zero, we need to start by asking where the 51 billion tons of emissions come from: https://t.co/S8d3tH98nk #MastersofScaleSummit https://t.co/oOb77eqPnD",1583163067185364997,423,1968,Twitter Web App
2022-10-20 03:21:43+00:00,The @Breakthrough Energy Summit is officially a wrap. Reaching net-zero emissions will be the hardest thing humanity has ever done – but I’m leaving today with an increased sense of hope. https://t.co/7zxKbypNOS,1582935064043655169,107,994,Twitter Web App
2022-10-20 03:20:21+00:00,Literally. https://t.co/vorXxKoMlM,1582934721444446208,79,1108,Twitter Web App
2022-10-20 03:20:20+00:00,Today was pretty special. I was able to get hands on with innovative climate tech that could help us reach net-zero. https://t.co/2yb7WylIH4,1582934715798941697,185,2609,Twitter Web App
2022-10-19 21:21:36+00:00,"The Five Grand Challenges can help us consider more ways to develop comprehensive solutions and reduce global emissions. Thank you, Project Art Collective, for your creativity in bringing them to life. https://t.co/XEoMcTcds8",1582844436232314881,128,1427,Twitter Web App
2022-10-19 21:19:13+00:00,"This is the “FOCUS” art installation on display at BE Summit. It cleverly represents the Five Grand Challenges — Electricity, Manufacturing, Agriculture, Transportation, and Buildings. https://t.co/34vCLetEdD",1582843838569549824,67,639,Twitter for iPhone
2022-10-19 21:00:05+00:00,"Grateful for your and @SecGranholm’s leadership. While we have made significant strides in climate innovation, we need more Breakthroughs. https://t.co/DlbE7bTkgz",1582839025013993472,82,685,Twitter Web App
2022-10-19 20:50:34+00:00,@JohnKerry @SecGranholm It’s unrealistic to expect people to stop traveling by plane. We must scale innovations that decarbonize the aviation industry. @LanzaJet will help us achieve this by building the world’s first plant for turning alcohol into sustainable aviation fuel. https://t.co/PMkbUl5i4Y,1582836627839143938,86,601,Twitter Web App
2022-10-19 14:06:28+00:00,"Yesterday was an important step toward a polio-free world: $2.6 billion committed will help protect millions of children. Thank you @SvenjaSchulze68, @Rotary, and the many other donors who pledged support. Let’s keep this momentum and #EndPolio together. https://t.co/GpHiiqiE1a",1582734932983836672,184,1210,Twitter Web App
2022-10-19 03:33:48+00:00,I’m leaving day 1 of #BESummit2022 feeling optimistic about the future after meeting with innovators who are developing the solutions we need to reach net-zero emissions. https://t.co/m0eSYkqcnP,1582575717312700421,77,954,Twitter Web App
2022-10-19 03:24:22+00:00,RT @Breakthrough: The first day of our #BESummit2022 addressed the state of the energy transition – where we’ve been and the Five Grand Cha…,1582573343118483456,78,0,Twitter Web App
2022-10-18 20:29:24+00:00,@Breakthrough Kicking things off reviewing #BESummit2022 activities with @Breakthrough’s Executive Director Rodi Guidero – here’s to a day full of learning and innovation. https://t.co/YAY0WZuDVv,1582468912880369664,115,1237,Twitter Web App
2022-10-18 17:47:33+00:00,"@Breakthrough In the run-up to the meeting, I decided to write out my thoughts on the state of the transition to zero. https://t.co/u8vyjhoUHt",1582428182912716801,137,979,Twitter Web App
2022-10-18 17:45:58+00:00,"This week, @Breakthrough Energy is starting an annual tradition. We’re hosting a gathering in Seattle where scientists, inventors, entrepreneurs, public officials, and corporate leaders from around the world will talk about what it’s going to take to get to net-zero emissions.",1582427783149461504,70,661,Twitter Web App
2022-10-18 17:43:12+00:00,I believe we’ll be able to avoid a climate disaster. The ultimate measure of success is global greenhouse-gas emissions: we need to go from 51 billion tons a year to 0 in the next three decades. I’m optimistic we can get there – if we take the right steps. https://t.co/gy25a2P4sa,1582427087863836673,669,4373,Twitter Web App
2022-10-17 23:01:28+00:00,"I’m bear-y honored to receive this adorable bear carrying such an urgent message: #EndPolio. As countries convene for the polio pledging moment, it’s vital they heed this bear’s message and commit to consigning polio to history. https://t.co/Ysr8n6LOTB",1582144794775629824,391,3350,Twitter Web App
2022-10-17 17:29:12+00:00,"I loved learning about how @maltaenergysto1 is meeting clean global energy demands by unlocking access to a wealth of inexpensive, clean energy. https://t.co/yFzCF1Orph",1582061176787435523,151,1038,Twitter Web App
2022-10-16 23:01:46+00:00,"Last week, I sat down with Bloomberg @business to talk about why I remain so committed to eradicating polio. By coming together and funding efforts like the Global Polio Eradication Initiative, we can #EndPolio and build a healthier world. https://t.co/ziQgsz5JMn",1581782483338924032,223,1746,Twitter Web App
